Tweets	id	len	date	source	likes	rt
RT @CNNEE: El expresidente de Perú Alan García murió este miércoles tras dispararse en la cabeza, https://t.co/cEPjhkWXtt	1118542595792228352	121	2019-04-17 15:51:51	Tweetbot for iΟS	0	626
El Museo Universitario de Arte Contemporáneo exhibió el trabajo de Weiwei en su décimo aniversario. Con su arte, We… https://t.co/NL6HpgIvkn	1118355763846680580	140	2019-04-17 03:29:26	TweetDeck	170	50
Fidel Narváez, excónsul de Ecuador en Londres, y Pedro Miguel, articulista del periódico mexicano La Jornada, coinc… https://t.co/IHI0lAiF8U	1118160991433515009	140	2019-04-16 14:35:29	TweetDeck	313	120
RT @CNNEE: Mira EN VIVO las imágenes del incendio en Notre Dame → https://t.co/phlRm5byqX https://t.co/YYHD1aTnPn	1117860562728357895	113	2019-04-15 18:41:41	TweetDeck	0	145
Trump dio un año al gobierno de México para controlar la inmigración indocumentada y el narcotráfico https://t.co/tJJ4QYgmaV	1115383097804169217	124	2019-04-08 22:37:07	TweetDeck	157	35
La organización Artículo 19 presentó su informe anual 'Ante el silencio, ni borrón ni cuenta nueva' en el que cuent… https://t.co/b9PrqZiqBX	1113971025614704640	140	2019-04-05 01:06:03	TweetDeck	236	82
"""Multilateralismo es cooperación, es acción colectiva"", dice María Fernanda Garcés https://t.co/WnKLF3lIal"	1113595471585579008	106	2019-04-04 00:13:44	TweetDeck	130	22
Esta noche hablaremos con María Fernanda Espinosa @UN_PGA, presidenta de la Asamblea General de las Naciones Unidas… https://t.co/u6rnI31h1N	1113227335472381952	140	2019-04-02 23:50:54	TweetDeck	146	27
Trump anunció que eliminará la ayuda económica a Honduras, Guatemala y El Salvador. Analizamos la situación en la f… https://t.co/xoAPOPVQHB	1113222930048143360	140	2019-04-02 23:33:23	TweetDeck	183	53
"""Disparos"" cuenta la historia de Jair Cabrera, un joven que a través de un taller de fotografía logra salir del cír… https://t.co/vLdPUqRY86"	1113147107949637633	140	2019-04-02 18:32:06	TweetDeck	177	44
Arnaldo Otegi: España no va a poder pagar su deuda https://t.co/q1Q0LKceka	1111789464425246720	74	2019-03-30 00:37:19	TweetDeck	160	43
"""Requerimos justicia para nuestros abuelos"", dice César Cruz Benítez, representante legal del pueblo Hñähñu. https://t.co/epyZbYJwFC"	1111112676585803776	132	2019-03-28 03:48:00	TweetDeck	252	71
El gobierno de España respondió al reclamo de López Obrador lamentando que se haya hecho público el envío de la car… https://t.co/jziJerjOyZ	1111090001457147905	140	2019-03-28 02:17:54	TweetDeck	303	59
RT @CNNEE: En https://t.co/phlRm5byqX encuentras toda la información que necesitas en un formato claro, dinámico y visual. Sigue en vivo el…	1111042093789646854	140	2019-03-27 23:07:31	Tweetbot for iΟS	0	36
Experto: Intervención rusa en elecciones está comprobada https://t.co/vEDZaqtntD	1110736066082996230	80	2019-03-27 02:51:29	TweetDeck	192	47
A 25 años del asesinato de Luis Donaldo Colosio, Carmen Aristegui entrevistó a @LauraSanchezLey sobre la desclasifi… https://t.co/E4wsJZWLQh	1110321559137329152	140	2019-03-25 23:24:23	TweetDeck	270	87
"Alberto Pfeifer dice que el poder judicial en Brasil es bastante independiente y que hace valer la ley.
https://t.co/9w3ouvHMmB"	1109293690055524352	127	2019-03-23 03:20:00	TweetDeck	142	22
"Un informe llevado a cabo por la Comisión 'The Lancet' señala interacción o ""sindemia global"" entre la obesidad, de… https://t.co/bBfkxhyqpj"	1108921039503929344	140	2019-03-22 02:39:13	TweetDeck	174	48
"La reunión Trump-Bolsonaro fue un encuentro entre ""dos líderes populistas y ultraconservadores"" con ideas y estilo… https://t.co/rTxJlh7blB"	1108457086663438341	139	2019-03-20 19:55:38	TweetDeck	151	46
Un experto de la OIT habló con @AristeguiCNN sobre el trabajo de esta organización para establecer mejores condicio… https://t.co/wE0urzShKV	1108097155808546817	140	2019-03-19 20:05:24	TweetDeck	127	26
El arquitecto Alejandro Aravena habló con Carmen Aristegui sobre su participación en la sexta edición del Festival… https://t.co/HzRwWGaPcJ	1107801164928729088	139	2019-03-19 00:29:14	TweetDeck	183	39
Todo el gabinete de AMLO hizo pública sus declaraciones patrimoniales. https://t.co/IgStU9yZxy	1106678632272068608	94	2019-03-15 22:08:41	TweetDeck	623	209
Estos son los escenarios económicos a los que se enfrentaría Gran Bretaña si sale de la Unión Europea sin un acuerdo https://t.co/UihlRIb9wK	1106035854710132738	140	2019-03-14 03:34:31	TweetDeck	277	83
En su mensaje presidencial López Obrador reconoció que en sus primeros 100 días subió la gasolina y no han bajado l… https://t.co/FuNeuoYwyN	1105617193323188224	140	2019-03-12 23:50:54	TweetDeck	439	132
Conoce lo que revelan las estadísticas sobre la violencia política y las agresiones que sufren las mujeres en Méxic… https://t.co/GKVXrpgthv	1105270297450684416	140	2019-03-12 00:52:28	TweetDeck	181	56
"En una cueva conocida como Balamkú, ""la cueva del dios jaguar"", se hallaron cientos de objetos de gran valor, cuya… https://t.co/7wIh0Y1unm"	1104227301275942912	139	2019-03-09 03:47:58	TweetDeck	1368	423
Los documentos que serán abiertos el próximo año son de entre 1939 a 1958, que corresponden a la época de la II Gue… https://t.co/AtZWBNbRHK	1104225690227011584	140	2019-03-09 03:41:34	TweetDeck	265	68
El jueves 7 de marzo se realiza la declaratoria de constitucionalidad de las reformas para la Guardia Nacional. ¿Po… https://t.co/tLYsJcG8RP	1103863178461675520	140	2019-03-08 03:41:05	TweetDeck	173	33
Respecto a la figura de Pablo Escobar, el alcalde @FicoGutierrez opina que fue una figura que simbolizó la cultura… https://t.co/cpCpzIJXrt	1103124289526497281	139	2019-03-06 02:45:00	TweetDeck	182	35
"Jarquín: ""Llama la atención el hecho de que se haya tomado cuatro sesiones y aún no se termina de acordar la hoja d… https://t.co/2mcjRqoILu"	1103112835595464704	140	2019-03-06 01:59:29	TweetDeck	125	30
".@FicoGutierrez: ""Aquí, en este espacio, se empieza construir a partir de este momento, un memorial a favor de las… https://t.co/gP1ZHe0eE1"	1102708286216904706	139	2019-03-04 23:11:57	TweetDeck	347	79
El abogado constitucionalista @afonsodelpino analiza con Carmen @aristeguicnn los últimos acontecimientos sobre Ven… https://t.co/aNdXLJNd8G	1101649988541657089	140	2019-03-02 01:06:39	TweetDeck	223	48
"La empresa Heckler &amp; Koch dijo que apoyó activamente la investigación del ""Caso México"" y acepta su responsabilidad… https://t.co/4uEBHoEGsE"	1100586310211944449	144	2019-02-27 02:39:58	TweetDeck	219	64
El director general de la OIT espera que durante la gestión de López Obrador se ratifiquen dos convenios pendientes… https://t.co/6eFaU64jd3	1100198639476068354	140	2019-02-26 00:59:31	TweetDeck	174	39
"La opinión del maestro de Cuarón sobre ""Roma"" https://t.co/iIOW184mXA"	1099421322063630336	69	2019-02-23 21:30:44	TweetDeck	259	55
El profesor de Alfonso Cuarón en el Centro Universitario de Estudios Cinematográficos de la UNAM habla sobre 'Roma'. https://t.co/8tYafNseAz	1099159577877233664	140	2019-02-23 04:10:39	TweetDeck	591	149
El futuro del a reforma laboral en México, según la OIT https://t.co/95OHBW5mg2	1098758932208717824	79	2019-02-22 01:38:38	TweetDeck	188	43
El mundo está atento a saber si logrará pasar la ayuda humanitaria a Venezuela https://t.co/pStM3ZqXEe	1098391930642358272	102	2019-02-21 01:20:18	TweetDeck	549	157
Estado mexicano responsable de tortura a mujeres de Atenco https://t.co/zQk4D5zMEc	1098031926055788545	82	2019-02-20 01:29:46	TweetDeck	476	206
"El 21 de diciembre de 2018, la CIDH encontró a México ""responsable de la violencia sexual, violación y tortura"" que… https://t.co/t5zmyslUDQ"	1097682747823394822	140	2019-02-19 02:22:15	TweetDeck	439	178
El exembajador de México ante la ONU Enrique Berruga dice que la declaratoria de emergencia nacional por parte del… https://t.co/k9LiMjohkl	1096589561650708480	139	2019-02-16 01:58:19	TweetDeck	362	84
Santiago Gamboa : López Obrador es progresista y de izquierda https://t.co/yWyHmAYTbE	1096157250656309248	85	2019-02-14 21:20:28	TweetDeck	205	61
Buscaglia: “El veredicto es histórico pero no solo para Estados Unidos sino para el planeta, el mundo entero” https://t.co/ChjQ3lZzVI	1095841855223353344	133	2019-02-14 00:27:12	TweetDeck	556	220
La obesidad en la vida moderno: la gente se mueve poco porque las ciudades están diseñadas para el uso del automóvi… https://t.co/F8V8rNiBZS	1095059620492660737	140	2019-02-11 20:38:53	TweetDeck	546	182
Charito Calvachi-Mateyko explica a Carmen Aristegui la relevancia del mecanismo de justicia restaurativa, método qu… https://t.co/sK1cJoMTQK	1094035187091025921	140	2019-02-09 00:48:09	TweetDeck	224	50
“Para que no haya impunidad, hay que crear un ambiente en que aquellos que han cometido atrocidades se sientan libr… https://t.co/9S2C691LNn	1094033006011080705	140	2019-02-09 00:39:29	TweetDeck	299	94
Mujica: No necesitamos una intervención militar https://t.co/IHpczMYlbn	1093938964183089159	71	2019-02-08 18:25:48	TweetDeck	549	260
José Mujica sobre Venezuela: Mi pequeño país no es neutral https://t.co/HId1U3pyJA Mira la entrevista completa esta… https://t.co/mQGWEUDxMC	1093326408909238272	140	2019-02-07 01:51:43	TweetDeck	596	232
Esta noche no te pierdas la entrevista de Carmen @aristeguicnn a José Mujica a las 11 pm ET, 10 pm hora México, en… https://t.co/1hvGIjPi6F	1093313548766318592	139	2019-02-07 01:00:37	TweetDeck	1725	489
El químico Benjamín Ruiz Loyola señaló el peligro que puede representar la inteligencia artificial para disparar mi… https://t.co/fG2G9yFMBF	1092873448697876480	140	2019-02-05 19:51:49	TweetDeck	236	70
Cepad denuncia irregularidades con cuerpos incinerados https://t.co/PmTQXt2dZa	1092576762804998144	78	2019-02-05 00:12:54	TweetDeck	252	90
".@MoisesNaim dice que las sanciones contra Venezuela crean un ""estrangulamiento financiero"" debilitando el gobierno… https://t.co/wQxBFXp1ov"	1091484846424293376	140	2019-02-01 23:54:00	TweetDeck	204	108
Para Heinz Dieterich, los militares venezolanos no tienen motivo para ir a la guerra y no tienen la fuerza para gan… https://t.co/y6F3S2yp0w	1091464643506245633	140	2019-02-01 22:33:44	TweetDeck	630	308
El diplomático mexicano @enriqueberruga habló con Carmen @aristeguicnn sobre el choque entre poderes en Venezuela.… https://t.co/lRr2BptSUN	1089979378719772672	139	2019-01-28 20:11:49	TweetDeck	217	55
"Esposa de Javier Valdez, periodista asesinado: ""La Fiscalía no debe descartar ninguna línea de investigación""… https://t.co/2sttOR7NPd"	1089141983682142209	134	2019-01-26 12:44:18	TweetDeck	482	113
¿Qué necesita Venezuela para lograr la paz? https://t.co/8Cj7JJyyJq	1088893635612024834	67	2019-01-25 20:17:28	TweetDeck	247	63
.@milosalcalay: Juan Guaidó “es el indicado a buscar mecanismos de solución pacifica a nivel internacional, pero no… https://t.co/EZdmvXHW1P	1088519064425775104	140	2019-01-24 19:29:03	TweetDeck	190	37
El periodista Carlos Fernando Chamorro explica a Carmen Aristegui las razones que lo motivaron a exiliarse en Costa… https://t.co/WnuRIahLlC	1088253511933009922	140	2019-01-24 01:53:50	TweetDeck	372	79
La periodista @AnaLilia_PerezM  hizo un análisis con Carmen @aristeguicnn sobre el robo de combustible en México, u… https://t.co/6gFAttLUmh	1088061955796021249	140	2019-01-23 13:12:40	TweetDeck	659	329
RT @CNNEE: Hoy el periodista Carlos Fernando Chamorro @cefeche, que salió de Nicaragua para exiliarse en Costa Rica, habla con @aristeguicn…	1087890004880384001	140	2019-01-23 01:49:23	TweetDeck	0	46
El brexit: los posibles escenarios, el liderazgo de Theresa May y otros factores que inciden en este momento de dec… https://t.co/KMWqhZhKN1	1087560492552519680	140	2019-01-22 04:00:01	TweetDeck	241	63
El destino político de brexit, la separación del Reino Unido de la Unión Europea y, sobre todo, el futuro de la pri… https://t.co/fMAn8AT5CJ	1086377730713808897	140	2019-01-18 21:40:09	TweetDeck	237	53
"La guerra contra el ""huachicoleo"" en México https://t.co/zoV0CHxGHI"	1085978452816289792	67	2019-01-17 19:13:34	TweetDeck	406	164
Jimmy Morales decidió no prorrogar el mandato de la CICIG en Guatemala y decidió cerrar las puertas del país al Com… https://t.co/Q39swC8GSm	1085331168575279104	140	2019-01-16 00:21:29	TweetDeck	241	79
Estado mexicano pide disculpas a Lydia Cacho https://t.co/XDRNBHr6Rs	1085047637164916741	68	2019-01-15 05:34:50	TweetDeck	441	95
RT @jamcnn: Hoy lanzamos el nuevo https://t.co/igcxbtYPHP. Han sido meses de trabajo, ideas, debates periodísticos y mucha pasión e ilusión…	1084821046988034048	140	2019-01-14 14:34:27	Tweetbot for iΟS	0	86
¿Responderá el T-MEC a las necesidades económicas de México, EE.UU. y Canadá? https://t.co/6bxYRo0Cn3	1083715136773390336	101	2019-01-11 13:19:57	TweetDeck	129	37
¿Por qué el calentamiento global conlleva a la migración? https://t.co/dIOA5x14r0	1082795256087752704	81	2019-01-09 00:24:41	TweetDeck	318	108
"Los llamados ""ninis"", pese a no trabajar o estudiar, están en la búsqueda de empleos o desarrollando trabajos no re… https://t.co/zpzwpKbLvj"	1077640914116460548	140	2018-12-25 19:03:10	TweetDeck	1024	377
"La realidad de la obra ""Dos espías en Caracas"" de @MoisesNaim  https://t.co/Q6x1lEUUY9"	1076275814239490053	86	2018-12-22 00:38:45	TweetDeck	184	41
La comunidad de inteligencia de EE.UU. está segura de que los rusos sí intervinieron en las elecciones presidencial… https://t.co/DCKPqrddC3	1075975718469816320	140	2018-12-21 04:46:16	TweetDeck	348	109
Una mirada a la fricción que tiene la primera ministra británica Theresa May con su partido y con la Unión Europea https://t.co/L84p6e7E6i	1075568789507465216	138	2018-12-20 01:49:17	TweetDeck	195	38
Autoridades en Nicaragua se toman instalaciones de Promedia https://t.co/gGuPacdILO	1075251377725693952	83	2018-12-19 04:48:00	TweetDeck	123	41
Autoridades de Nicaragua confiscan equipo y las instalaciones de Promedia e Invermedia de propiedad del periodista… https://t.co/tVbFX11OGZ	1075238916771471360	139	2018-12-19 03:58:29	TweetDeck	186	83
"Según Fidel Narváez, Ecuador cambió su política internacional y ya no protege a Assange. ""Donald Trump quiere la ca… https://t.co/6W2SUd5Htl"	1073708915706224640	140	2018-12-14 22:38:48	TweetDeck	389	310
El brexit: ¿una guerra interna del Partido Conservador? https://t.co/227F5aVaJH	1073544379917201408	79	2018-12-14 11:45:00	TweetDeck	110	21
Lorena Ruano, del Centro de Investigaciones y Docencia Económicas, explica que algunos sectores políticos en Reino… https://t.co/gPUXpW9v0V	1073444337810325504	139	2018-12-14 05:07:28	TweetDeck	195	44
Chomsky critica a Estados Unidos y Canadá por la falta de solidaridad en la búsqueda a una solución al problema en… https://t.co/GEHPpVOXID	1073055596025401349	139	2018-12-13 03:22:45	TweetDeck	1364	610
RT @CNNEE: 20 millones de personas en Estados Unidos bajo la amenaza de una gran tormenta invernal https://t.co/9FsvqCyv23 https://t.co/zAU…	1071388210381668352	140	2018-12-08 12:57:09	Twitter for iPhone	0	193
RT @CNNEEVideo: Esto dijo el presidente de Ecuador Lenín Moreno sobre su reunión con Paul Manafort y las condiciones para que Julian Assang…	1071145949345517575	140	2018-12-07 20:54:29	TweetDeck	0	34
.@Lenin Moreno, en entrevista con Carmen @aristeguicnn, dijo que se está buscando una solución con el gobierno de G… https://t.co/MsJb3RRaaw	1070855576173928448	140	2018-12-07 01:40:39	TweetDeck	225	85
Enrique Peña Nieto, ¿un sexenio fallido? Esto dijeron los periodistas @ricardomraphael y Ernesto Núñez (@chamanesco… https://t.co/wQRWIjBz2r	1068174140304183296	140	2018-11-29 16:05:35	TweetDeck	345	110
"La periodista Anabel Hernández, autora del libro ""Los Señores del Narco"", reflexiona sobre la estrategia del abogad… https://t.co/fjNHQTfsFX"	1063621763551109120	140	2018-11-17 02:36:04	TweetDeck	823	419
Abogado del Chapo acusa a Peña y Calderón, ¿con qué fin? https://t.co/Fw1nJ5V4YT	1062921098021474304	80	2018-11-15 04:11:52	TweetDeck	926	335
"RT @CNNEEVideo: ¿Cuáles serían las posibles sentencias para Joaquín ""El Chapo"" Guzmán? Esto y más sobre el juicio en Nueva York en @aristeg…"	1062891702409707521	140	2018-11-15 02:15:04	TweetDeck	0	128
"La analista Ana María Salazar dice que Trump ""pone en peligro la vida de Acosta"" mientras que el analista Gerardo R… https://t.co/48YaU1M7Fc"	1060620401171185670	140	2018-11-08 19:49:43	TweetDeck	450	201
El riesgo de las lluvias en México es el desbordamiento de las presas https://t.co/MIAUNv8uiG	1055663784755412997	93	2018-10-26 03:33:54	TweetDeck	457	177
RT @CNNEE: Sigue a @CNNMex para conocer las últimas noticias sobre México https://t.co/5zQ3rOXubI https://t.co/EzZD4wBnWR	1055172216927727627	121	2018-10-24 19:00:35	Tweetbot for Mac	0	50
Analistas coinciden en que el Gobierno de Turquía buscará un acercamiento con el presidente de EE.UU. Donald Trump… https://t.co/x0Sb4Y2can	1054511980487368707	139	2018-10-22 23:17:02	TweetDeck	160	102
El profesor Jorge Durand explica el cambio en la migración desde América Central a Estados Unidos https://t.co/8rszQkexS9	1053486930015461376	121	2018-10-20 03:23:51	TweetDeck	252	145
Una demanda contra un fabricante de armas de Alemania pretende que se haga justicia para una víctima del caso Ayotz… https://t.co/6WISRl3bd4	1052407056374861831	140	2018-10-17 03:52:49	TweetDeck	608	299
RT @CNNEE: ÚLTIMA HORA: El Nobel de Física 2018 va para tres científicos por sus investigaciones sobre el láser https://t.co/EXn8DZRfEt htt…	1047068051684937728	140	2018-10-02 10:17:31	Tweetbot for iΟS	0	486
Hoy el @EdgardBuscaglia analiza  el informe de la Comisión Global sobre Drogas, en @CNNEE a las 10pm #México (11pm… https://t.co/fDZKBvLjTy	1045853152195612674	139	2018-09-29 01:49:57	TweetDeck	269	89
Carmen Aristegui regresa a la radio mexicana con la alianza entre el portal web AristeguiNoticias y el grupo radiof… https://t.co/dADBOX7vfA	1045850622929653762	140	2018-09-29 01:39:54	TweetDeck	2394	615
RT @CNNEE: Carmen Aristegui regresa a la radio mexicana tras tres años de ausencia https://t.co/X7Rd5TbiXn https://t.co/IRvwVz7bzC	1045827364037554180	130	2018-09-29 00:07:28	TweetDeck	0	243
El expresidente de Colombia César Gaviria comenta que hace 10 años no había una investigación sobre las drogas, sus… https://t.co/IX70RxI3gr	1045506883509878785	140	2018-09-28 02:54:00	TweetDeck	225	63
Ruth Dreifuss, expresidenta de Suiza, explica el caso del país europeo como un ejemplo para otras regiones en la le… https://t.co/BXIc8FJGdc	1045500885298814977	140	2018-09-28 02:30:10	TweetDeck	415	156
Padres de los 43 estudiantes de Ayotzinapa consideran que el Gobierno está involucrado en la desaparición de sus hi… https://t.co/mKQ2IDn5bT	1045465917403144193	140	2018-09-28 00:11:13	TweetDeck	612	271
"RT @CNNEE: Dreifuss: La prohibición de la marihuana ha evitado su investigación cómo medicamento ➡️ https://t.co/D3dRuvHpai
No te pierdas e…"	1044665237788643329	140	2018-09-25 19:09:36	TweetDeck	0	52
La guerra comercial entre EE.UU. y China podría incluso llegar a la lucha militar en el espacio, dice el experto Ju… https://t.co/MVcZMuG8DW	1042634699783499776	140	2018-09-20 04:40:58	TweetDeck	274	85
