Tweets	id	len	date	source	likes	rt
La contingencia ambiental sigue y mañana no podrán circular autos con holograma 1 terminación non, holograma 2 y en… https://t.co/vSbNxk2BIN	1118700946186547200	140	2019-04-18 02:21:04	GRFeed	2	1
Antes de las vacaciones de Semana Santa, una rata se metió a las oficinas de la bancada de @PartidoMorenaMx en la C… https://t.co/ACfczarD6y	1118699431640084480	140	2019-04-18 02:15:03	Hootsuite Inc.	8	7
📹 #NotiMinutoSeguridad Por un infarto, un hombre de la tercera edad falleció en la estación del Metrobús Colonia De… https://t.co/Yz8b1IGr88	1118695735422267392	140	2019-04-18 02:00:22	Hootsuite Inc.	4	3
Estados Unidos elevó la alerta a sus ciudadanos y turistas en México por el incremento de secuestros y toma de rehe… https://t.co/FQR3E6e37K	1118694733486940161	140	2019-04-18 01:56:23	GRFeed	13	16
La Comisión Presidencial para la Verdad y la Justicia del caso Ayotzinapa acordó crear un grupo para la búsqueda en… https://t.co/SD3QRLgwsu	1118694731641425920	140	2019-04-18 01:56:23	GRFeed	5	2
#LoÚltimo La @CAMegalopolis informó que se mantiene la contingencia ambiental en el Valle de México por mala calida… https://t.co/rUuCq5hQsM	1118693769757515776	140	2019-04-18 01:52:33	Hootsuite Inc.	5	4
Chavela Vargas renunció a cantar las rancheras con tacones y falda. Armó revuelo cuando comenzó a presentarse con p… https://t.co/SSNWaQd30i	1118691885877485569	140	2019-04-18 01:45:04	Hootsuite Inc.	27	2
El ex Presidente de Perú Alan García se disparó antes de ser arrestado, pero él era sólo uno de los cuatro ex Manda… https://t.co/lFKY25CuFO	1118688995389603840	140	2019-04-18 01:33:35	Hootsuite Inc.	24	8
#LoÚltimo La comisión del caso Ayotzinapa acordó crear un grupo de búsqueda para dar con el paradero de los 43 norm… https://t.co/BRPrJlKmKW	1118684817720270848	140	2019-04-18 01:16:59	Hootsuite Inc.	7	7
Con amparos y en autobuses, este 17 de abril, alrededor de 300 cubanos partieron de Tapachula, Chiapas hacia el nor… https://t.co/P9s1sxlo9u	1118684333798195202	140	2019-04-18 01:15:03	Hootsuite Inc.	3	5
La Secretaría del Trabajo y Previsión Social otorgó la toma de nota a la Confederación Internacional de Trabajadore… https://t.co/HSge9ZJzDI	1118682085143777280	140	2019-04-18 01:06:07	GRFeed	9	6
¿Cómo es vivir sin luz? Aunque los apagones en Venezuela son frecuentes, la extensión de los últimos ha obligado a… https://t.co/Q6Q56fEP8U	1118680599630426112	139	2019-04-18 01:00:13	Hootsuite Inc.	3	1
📹 #NotiMinutoSeguridad Una ambulancia chocó contra un taxi en el Centro y el pasajero resulto herido https://t.co/IGVSSa2cYR	1118680594567913472	124	2019-04-18 01:00:12	Hootsuite Inc.	4	1
La UAM lleva 75 días en paro y sus estudiantes ya empezaron a juntar firmas para reabrir los planteles https://t.co/AFi96Ofhkv	1118676785519038464	126	2019-04-18 00:45:04	Hootsuite Inc.	12	5
RT @reformaciudad: 📷 Una cuadrilla de trabajadores de la @SOBSECDMX quitó el tiradero clandestino de la calle Puerto Rico, a un costado de…	1118673481430859776	139	2019-04-18 00:31:56	Twitter Web Client	0	6
¿No sabes qué películas ver estas vacaciones? Los críticos de @laveoonolaveo te comparten opciones de 10 categorías… https://t.co/fNjFaoOHWm	1118673032141316098	140	2019-04-18 00:30:09	Hootsuite Inc.	5	1
El Instituto Nacional de Migración y la Policía Federal frenaron el avance del 'viacrucis' de cubanos que partió es… https://t.co/DqMohMxTOQ	1118671553569402880	140	2019-04-18 00:24:16	GRFeed	18	5
"🎥 ""La Maldición de la Llorona"" es la versión estadounidense de esta leyenda mexicana. Mira @laveoonolaveo para cono… https://t.co/N0vBpuP7NV"	1118669243934023680	140	2019-04-18 00:15:06	Hootsuite Inc.	5	2
En demanda de un aumento salarial en UAM, integrantes del SITUAM piden 50 pesos a automovilistas en la caseta de la… https://t.co/d2id5eFWwQ	1118667065597022209	140	2019-04-18 00:06:26	GRFeed	2	6
📹 #NotiMinutoSeguridad Un hombre murió apuñalado durante una riña, en la Colonia Obrera, en Cuauhtémoc https://t.co/IGVSSa2cYR	1118665487565709316	126	2019-04-18 00:00:10	Hootsuite Inc.	6	1
"🎥 Llega a cartelera ""La Maldición de la Llorona"", basada en la leyenda mexicana. Los críticos de @laveoonolaveo te… https://t.co/idjVewjPxY"	1118661705427574785	139	2019-04-17 23:45:08	Hootsuite Inc.	3	1
RT @reformanacional: Sala del TEPJF exoneró al Presidente AMLO y al Secretario de Turismo, Miguel Torruco, por un spot de Sectur con el log…	1118659384236806146	140	2019-04-17 23:35:55	Twitter Web Client	0	43
El abuso del alcohol llevó al límite a #ChavelaVargas, dejó de ser contratada para cantar. Desapareció de la escena… https://t.co/UZZGnlqiB8	1118654144603201537	140	2019-04-17 23:15:06	Hootsuite Inc.	16	9
Corea del Norte informó que probó un nuevo tipo de arma guiada táctica bajo supervisión del líder Kim Jong Un. https://t.co/S5cVePYMza	1118651785495941126	134	2019-04-17 23:05:43	GRFeed	8	12
#LoMásVisto El empresario francés Francois-Henri Pinault, esposo de la actriz mexicana @salmahayek, anunció que don… https://t.co/Z4IAPDDTQb	1118650404911439874	140	2019-04-17 23:00:14	Hootsuite Inc.	11	4
Integrantes del SITUAM bloquean la carretera Picacho-Ajusco, casi esquina con Periférico, ante rechazo de autoridad… https://t.co/UAUQasJ8ek	1118649462753251329	140	2019-04-17 22:56:30	GRFeed	16	15
El Presidente de Argentina, @mauriciomacri, anunció medidas contra la inflación en un video con vecinos, lo que pro… https://t.co/EKeVH1RZ63	1118647198344974338	140	2019-04-17 22:47:30	Hootsuite Inc.	5	3
Dulce, salado, ácido, picoso, y sobre todo facilísimo: mira cómo hacer lomo de cerdo con salsa de mango en… https://t.co/wVQFyMOHLc	1118646604913885184	131	2019-04-17 22:45:08	Hootsuite Inc.	10	10
El Gobernador de Morelos, @cuauhtemocb10, atribuyó los asesinatos registrados en la entidad a la disputa entre cárt… https://t.co/JPqVc3zFnf	1118643208458768384	140	2019-04-17 22:31:38	GRFeed	8	7
El jurado del Premio Firenze Entremuros 2019, José Picciotto, dice que concursos de arquitectura y diseño son buen… https://t.co/q4QnK2Ffq6	1118642857328480258	139	2019-04-17 22:30:15	Hootsuite Inc.	4	1
¡Ahora será posible consultar los sueldos de funcionarios! La @SFP_mx presentó este lunes el portal 'Nómina Transpa… https://t.co/dWYlETcc5H	1118639055036669953	140	2019-04-17 22:15:08	Hootsuite Inc.	7	6
El Gobierno de Perú declaró tres días de duelo por la muerte del ex Presidente Alan García, tras un disparo antes d… https://t.co/BV8Pael12B	1118637286223167488	140	2019-04-17 22:08:06	GRFeed	6	5
RT @elnorte: XBOX One S All digital edition llegará el 7 de mayo y en #GamingLab 🎮 te contamos las novedades #gaming https://t.co/Q9ngybDgoQ	1118635545503117312	140	2019-04-17 22:01:11	Hootsuite Inc.	0	4
"🎥 ""Parque Mágico"" es el lugar donde cobra vida la imaginación de June. Mira lo que pensaron los críticos de… https://t.co/4lp1qU2Lhs"	1118635400262819845	132	2019-04-17 22:00:37	Hootsuite Inc.	2	1
"A bordo de cinco autobuses y dos camionetas alrededor de 300 cubanos emprendieron esta tarde el ""viacrucis"" hacia e… https://t.co/lD8yFfZJIL"	1118634633699241994	140	2019-04-17 21:57:34	GRFeed	3	4
El suicidio del ex Presidente peruano Alan García ha conmocionado al país y agrava el impacto de la crisis por el c… https://t.co/8WwkHRsIo7	1118633793718452226	140	2019-04-17 21:54:14	GRFeed	15	12
Hernández Vega fue uno de los miembros del Estado Mayor que solicitó su retiro anticipado como Teniente Coronel de… https://t.co/MPOTNP82W2	1118631542463578112	139	2019-04-17 21:45:17	GRFeed	8	7
RT @reformanegocios: ¿Te has preguntado cuánto ganan los actores de #GoT?  Kit Harington (#JonSnow) y Emilia Clarke (#DaenerysTargaryen) ob…	1118630959635664896	140	2019-04-17 21:42:58	Twitter Web Client	0	5
"🎥 ¿Dejarías la prudencia por lograr lo que quieres? Los críticos de @laveoonolaveo te platican sobre ""Enamorado de… https://t.co/bs1xrCMIei"	1118627808031444994	139	2019-04-17 21:30:27	Hootsuite Inc.	4	2
El Tottenham Hotspur cayó 4-3, global 4-4, contra el Manchester City, pero avanzó a las Semifinales de la Liga de C… https://t.co/7NjYvPhy37	1118627028893413377	140	2019-04-17 21:27:21	GRFeed	14	0
🎥 El éxito de taquillas del 2016 ahora tiene secuela. Entérate de lo que pensaron los críticos de @laveoonolaveo so… https://t.co/nNUxVyRzZd	1118620295672283143	140	2019-04-17 21:00:36	Hootsuite Inc.	5	2
Ni la contaminación ni el calor ceden y la Ciudad sigue en nivel de contingencia... aun así, el @GobCDMX determinó… https://t.co/SHQjRS5vIk	1118617665759846402	139	2019-04-17 20:50:09	GRFeed	23	12
.@iWillSmith arribó a Oacalco, municipio de Yautepec, Morelos por la filmación de 'Bad Boys for Life' https://t.co/2kECSyA79O	1118616397209325568	125	2019-04-17 20:45:06	Hootsuite Inc.	21	6
En Michoacán se seguirá aplicando la reforma educativa, pese al memorándum que firmó ayer el Presidente López Obrad… https://t.co/shDGKwVrCe	1118615993855696896	140	2019-04-17 20:43:30	GRFeed	103	33
"""Si una ley expedida es injusta, en esta nueva realidad, el Congreso la debe modificar y volverla justa"", expresó M… https://t.co/qFElRKtLqO"	1118613409627611136	140	2019-04-17 20:33:14	GRFeed	18	13
La asesora de la Casa Blanca Ivanka Trump afirmó que su padre le preguntó si estaba interesada en aceptar el cargo… https://t.co/wSO6tnWzOE	1118612667630006272	139	2019-04-17 20:30:17	Hootsuite Inc.	6	5
RT @reformanacional: Durante los dos días que el Hospital Infantil no otorgó servicio de Consulta Externa alrededor de 800 citas programada…	1118610624144125952	140	2019-04-17 20:22:10	Twitter Web Client	0	18
Chavela Vargas nació un 17 de abril de 1919; le bastaron su voz áspera, desgarrada, y su guitarra para dejar una hu… https://t.co/z1Ws4pZaeh	1118609840488767489	140	2019-04-17 20:19:03	Hootsuite Inc.	23	7
#PorSiNoLoLeíste Después de que fue cuestionado por @jorgeramosnews y éste a su vez criticado en redes, el Presiden… https://t.co/eu5tKz1azJ	1118605099901779971	140	2019-04-17 20:00:13	Hootsuite Inc.	22	14
Un grupo de familiares de personas desaparecidas mantiene un plantón afuera de la Segob, en demanda de una audienci… https://t.co/wps1CMW6VX	1118602336174313472	140	2019-04-17 19:49:14	GRFeed	4	5
Un toque dulce de mango, un toque picante de habanero… No te puedes perder esta receta de lomo de cerdo con salsa d… https://t.co/OKGYzPKfVa	1118601333458833415	140	2019-04-17 19:45:15	Hootsuite Inc.	7	0
Policías comunitarios de la UPOEG fueron atacados en la localidad de Ayutla de los Libres https://t.co/LvPbIWyKSd	1118600090170609664	113	2019-04-17 19:40:18	GRFeed	3	2
#PorSiNoLoViste La senadora @jesusardgz interpretó versos de Sor Juana para asegurar que si la religiosa viviera es… https://t.co/8MEVE9SWwd	1118598794646573057	140	2019-04-17 19:35:09	Hootsuite Inc.	5	5
.@SNietoCastillo catalogó el actuar del ex Director de @Pemex como el de un político de una dictadura africana, y n… https://t.co/38ZxRBhklg	1118597572443217920	140	2019-04-17 19:30:18	Hootsuite Inc.	6	7
Will Smith(@iWillSmith)sorprendió a los lugareños del municipio de Yautepec, Morelos. https://t.co/k4j1WEABaJ	1118594103451770880	109	2019-04-17 19:16:31	GRFeed	85	43
Esta mañana, el Presidente @lopezobrador_ dijo que si hay que optar entre la ley y la justicia se debe decidir a fa… https://t.co/rpx2qMRT0R	1118593761104187392	140	2019-04-17 19:15:09	Hootsuite Inc.	7	3
Organismos saludaron sentencia que reconoce a la Comisión Ejecutiva de Atención a Víctimas como autoridad competent… https://t.co/71Uxyt8bHo	1118591853576818688	140	2019-04-17 19:07:34	GRFeed	12	8
RT @reformanegocios: #GameOfThrones no se ha salvado de las descargas ilegales. Entre los países cuyos usuarios incurren más en ello están…	1118591475984556032	139	2019-04-17 19:06:04	Twitter Web Client	0	3
El Presidente de Francia, @EmmanuelMacron, subió la presión al fijar un plazo de cinco años para restaurar el monum… https://t.co/RF3pmNnvIw	1118590023060869123	140	2019-04-17 19:00:18	Hootsuite Inc.	10	0
Gobierno de Trump ordenó restricciones de viaje de estadounidenses a Cuba y reimpuso límites en remesas de EU a la… https://t.co/xKfPrGkRdy	1118588734910472193	139	2019-04-17 18:55:11	GRFeed	6	5
A partir de mañana, López Obrador suspenderá actividades por Semana Santa https://t.co/AHVnmvKCwb	1118587896070660109	97	2019-04-17 18:51:51	GRFeed	35	10
RT @reformagente: Will Smith(@iWillSmith)sorprendió a los lugareños del municipio de Yautepec, Morelos. https://t.co/iyOFVknaoa	1118586347420291072	127	2019-04-17 18:45:42	Twitter Web Client	0	4
"🎥 La nueva cinta ""La Maldición de la Llorona"" fue producida por James Wan, quien ha dirigido filmes como ""Saw"". Con… https://t.co/z6DN8B7Ril"	1118586208676978688	140	2019-04-17 18:45:09	Hootsuite Inc.	3	1
RT @reformanegocios: Promete Disney 5 mdd para Notre Dame https://t.co/oAeUz11HA1	1118583639388848128	81	2019-04-17 18:34:56	Twitter Web Client	0	2
Autoridades informaron que combaten un incendio forestal en La Primavera,  en el paraje San José de La Montaña, ubi… https://t.co/y6BodorLco	1118583046905704449	140	2019-04-17 18:32:35	GRFeed	6	4
Saturan puentes de Reynosa https://t.co/lxgO6pvJGv	1118583045106302976	50	2019-04-17 18:32:34	GRFeed	6	1
"¡Toma tus precauciones!

-Un grupo de encapuchados tomó caseta de cobro de la México-Cuernavaca, piden 50 pesos par… https://t.co/JNGCSgpJyv"	1118582525822107653	140	2019-04-17 18:30:31	Hootsuite Inc.	22	20
RT @reformaciudad: ⚠️ Sólo hoy y debido a las vacaciones, a partir de las 18:00 horas, todos los vehículos, sin restricción, podrán circula…	1118579208903692288	140	2019-04-17 18:17:20	Twitter for iPhone	0	4
Desde que se liberaron los precios de la gasolina en 2017, más de 70 marcas han incursionado en su venta. ¿Por qué… https://t.co/8X68IP85KB	1118579008617230336	139	2019-04-17 18:16:32	Hootsuite Inc.	5	5
"""Son 22 colonias donde más sucede la incidencia (del robo a casa habitación), esto respecto a datos de los últimos… https://t.co/kbLfd81PLp"	1118578791587221505	139	2019-04-17 18:15:40	GRFeed	13	15
"RT @ReformaGadgets: #AccesoLibre 🔓
@SpotifyMexico cumple 6 años en México, tiempo en el que la @BANDA_MS se coloca como lo más escuchado en…"	1118574762924679169	140	2019-04-17 17:59:40	Twitter Web Client	0	5
"¿Qué busca el @GobiernoMX con acuerdo sobre Política de Comunicación Social?

-Fijar topes para la contratación de… https://t.co/Nqvzdz2XlZ"	1118574644083265536	139	2019-04-17 17:59:11	Twitter Web Client	10	8
.@lopezobrador_ dijo que si hay que optar entre la ley y la justicia se debe decidir en favor de la justicia, pues… https://t.co/E9mAieSfv6	1118574643210784774	139	2019-04-17 17:59:11	Twitter Web Client	13	7
"""Celebro que se proceda legalmente, este también es un signo de los nuevos tiempos"", apuntó el titular del Ejecutiv… https://t.co/LizdAzk4GB"	1118574642313277441	140	2019-04-17 17:59:11	Twitter Web Client	0	1
"En medio de críticas de la Oposición y expertos, el Mandatario @lopezobrador_ justificó el memorándum para ""vetar""… https://t.co/gbjtnWd5Ad"	1118574640534884354	139	2019-04-17 17:59:11	Twitter Web Client	0	3
¿Cuáles fueron los temas de la conferencia del Presidente @lopezobrador_ este 17 de abril? Échale ojo a este hilo 👇… https://t.co/Oi9Pn8lFtk	1118574639242936320	140	2019-04-17 17:59:10	Twitter Web Client	14	7
RT @AutomotrizGR: La SUV pequeña de Lincoln hizo su debut en Nueva York y se llama Corsair. Estrena nuevo lenguaje de diseño exterior y des…	1118571196071776256	140	2019-04-17 17:45:29	Twitter Web Client	0	8
RT @AutomotrizGR: ¿Y qué podemos esperar del monstruoso GT-R para el futuro? #NYIAS2019 #NYIASNissan https://t.co/6tRjtp3fVo	1118571118753976320	124	2019-04-17 17:45:11	Twitter Web Client	0	2
Luego de dispararse en la cabeza con un arma de fuego ante la llegada de la Policía a su domicilio para arrestarlo… https://t.co/zzszGDDy2N	1118568619582132225	139	2019-04-17 17:35:15	Twitter Web Client	4	4
Con una ceremonia, la @PoliciaFedMx destacó la labor de los 166 integrantes de su Unidad Canina, que este 16 de abr… https://t.co/2BykBVAt6m	1118567901269831681	140	2019-04-17 17:32:24	Hootsuite Inc.	16	11
Trump aseguró que habló con el Papa Francisco para ofrecer la ayuda de EU para la reconstrucción de la Catedral de… https://t.co/BcsyS0gtf8	1118556160007839745	139	2019-04-17 16:45:44	GRFeed	12	1
Es sencillísimo hacer nuevas recetas en la parrilla: aprende cómo hacer este lomo de cerdo con salsa de mango en… https://t.co/rcNBvp1g7Q	1118556048686817282	137	2019-04-17 16:45:18	Hootsuite Inc.	4	0
También unos 300 cubanos partirán hoy en autobuses hacia el norte del País en busca de pedir asilo a los Estados Un… https://t.co/QYjNPFSvPC	1118554194338820097	140	2019-04-17 16:37:56	GRFeed	5	2
Un grupo de personas encapuchadas tomó la caseta de cobro de la Autopista México-Cuernavaca en la piden 50 pesos a… https://t.co/WOSTEoFH0u	1118551299413413888	139	2019-04-17 16:26:26	GRFeed	174	162
Debido a que se mantienen los sistemas de alta presión en el Pacífico y el Golfo de México... seguimos en contingen… https://t.co/Ur8mXwjDFZ	1118544977531949056	140	2019-04-17 16:01:18	GRFeed	10	5
Con un memorándum, el senador panista Julen Rementería del Puerto advirtió a los titulares de SHCP, SEP y Segob que… https://t.co/ObvVhrsqgZ	1118543567503417345	140	2019-04-17 15:55:42	GRFeed	108	48
Aumentan 5% exportaciones de México a EU https://t.co/LVR1UtJtAt	1118543284580777984	64	2019-04-17 15:54:35	GRFeed	12	6
El ex Presidente peruano Alan García murió tras dispararse en la cabeza ante la llegada de agentes para arrestarlos… https://t.co/qk74dwspc5	1118540444978302976	140	2019-04-17 15:43:18	GRFeed	16	15
Después de brillar en #Roma, @YalitzaAparicio es considerada como una de las personas más influyentes del medio art… https://t.co/iDMQA9hq6T	1118533938958557184	140	2019-04-17 15:17:27	GRFeed	84	24
La revista Time incluyó al Presidente de México, Andrés Manuel López Obrador, entre los líderes más influyentes de… https://t.co/u8wzdYc97o	1118531959188275200	139	2019-04-17 15:09:35	GRFeed	89	33
RT @reformanegocios: #ConsultorioFinanciero Como empresa ¿dudas de implementar el home office? 🏡Debes saber que podrás incrementar la produ…	1118529943812624386	140	2019-04-17 15:01:34	Hootsuite Inc.	0	5
La NFL anunció que el juego entre Chiefs y Chargers se jugará el lunes 18 de noviembre en el Estadio Azteca. https://t.co/VjTLToxfJu	1118524307532021760	132	2019-04-17 14:39:10	GRFeed	9	1
RT @reformanegocios: #GameOfThrones  es un fenómeno mundial. Desde su lanzamiento, ha roto récords en costos y audiencia 📺. Checa algunas c…	1118523653786939393	140	2019-04-17 14:36:34	Hootsuite Inc.	0	5
En marzo, la ciudad con mayor porcentaje de personas que consideró que vivir en su ciudad es inseguro fue Tapachula… https://t.co/QHlJsKTXfP	1118518925359083527	140	2019-04-17 14:17:47	GRFeed	16	4
Pide AMLO privilegiar justicia sobre ley https://t.co/PJuygyvHhS	1118518923434102784	64	2019-04-17 14:17:47	GRFeed	12	1
"🎥 Después de la primera vez, nada es igual. Los críticos de @laveoonolaveo te hablan más sobre ""After"" ➡… https://t.co/lnE638WDvK"	1118517036941029377	129	2019-04-17 14:10:17	Hootsuite Inc.	5	1
El ex Presidente peruano Pedro Pablo Kuczynski fue trasladado a una clínica desde prisión tras presentar un cuadro… https://t.co/DI0RxRgDVu	1118514515191189504	139	2019-04-17 14:00:16	GRFeed	4	5
Tras emitirse orden detención por caso Odebrecht, el ex Presidente peruano Alan García fue ingresado a un hospital… https://t.co/08SVzH0siT	1118512832029634560	139	2019-04-17 13:53:34	GRFeed	19	10
"El Presidente Andrés Manuel López Obrador defendió el memorándum para ""vetar"" la ley educativa vigente; dijo que si… https://t.co/B9I2MShgth"	1118509468340277253	140	2019-04-17 13:40:12	GRFeed	60	31
"🎥 En ""Nacido para Ser Rey"", el joven Álex tendrá que convertirse en el líder que nunca habría creído poder ser. Ent… https://t.co/89o18mF80a"	1118504436576473093	140	2019-04-17 13:20:13	Hootsuite Inc.	3	1
