Tweets	id	len	date	source	likes	rt
Los Rockets lucen imparables esta postemporada con su poderosa ofensiva comandada por Harden y Paul, ¿qué tan lejos… https://t.co/3N2g3w1exS	1118701179175702528	140	2019-04-18 02:22:00	Twitter Media Studio	4	0
Estos son los vehículos que no circularán por la Contingencia Ambiental este jueves https://t.co/Wb9qf0pgFu https://t.co/GnPuz6YrsM	1118699418205806593	131	2019-04-18 02:15:00	TweetDeck	8	1
Estimado @RicardoMonrealA No voy a entrar en la discusión que tuve en filosofía del Derecho, pero el elemento esenc… https://t.co/zfWoYpTSfi	1118697068950958083	140	2019-04-18 02:05:40	Twitter for iPhone	185	75
Kim Jong-un personalmente guía disparo de nueva arma táctica https://t.co/7mZdB9WQSd https://t.co/vgHYwgSOMJ	1118695390998454272	108	2019-04-18 01:59:00	TweetDeck	13	0
El peso tiene ligera recuperación frente al dólar https://t.co/80Hf1WL7Ya https://t.co/PMOVrpMuXo	1118691872791126016	97	2019-04-18 01:45:01	TweetDeck	9	2
El récord que buscará romper la astronauta estadounidense Christina Koch https://t.co/IawSNcYQGf https://t.co/2FbUjs1iEO	1118688093387853825	120	2019-04-18 01:30:00	TweetDeck	15	2
Aviso. https://t.co/Yx3GZ92hBO	1118687421212831744	30	2019-04-18 01:27:20	Twitter for iPhone	23	14
RT @Cuauhtemoc_1521: Mexicano del siglo XXI, ¿te es vergonzoso que las culturas mesoamericanas realizaran sacrificios humanos? Acaso por re…	1118687131344543746	140	2019-04-18 01:26:10	Twitter for iPhone	0	174
Rayo deja cuatro lesionados en la acrópolis de Atenas https://t.co/3TrnWVFROX https://t.co/ws6OSzHOYh	1118684318451339265	101	2019-04-18 01:15:00	TweetDeck	20	5
La Profeco puso en funcionamiento el número 55-68-68-25-89 donde se podrá denunciar establecimientos que no cumplan… https://t.co/6UK3gjywGm	1118680545783840768	140	2019-04-18 01:00:00	TweetDeck	24	16
"Los manifestantes pedían ""cooperación voluntaria"" de 50 pesos, los cuales presuntamente serían utilizados para libe… https://t.co/oulqK1hZow"	1118678881676869632	140	2019-04-18 00:53:24	TweetDeck	45	20
"Suspenden deportación de niña salvadoreña de Estados Unidos.

Laura Maradiaga, de 11 años, estuvo a punto de ser en… https://t.co/oPmq8d6pv9"	1118676768787980289	140	2019-04-18 00:45:00	TweetDeck	9	0
Tras más de 12 horas, manifestantes liberan caseta de Tlalpan	1118675879494733824	61	2019-04-18 00:41:28	TweetDeck	56	16
Malas noticias para el América. El cuadro de Coapa sufrió cuatro bajas durante entrenamiento https://t.co/XZOg6FPtPf https://t.co/hLoWuPlZaD	1118672993343827968	140	2019-04-18 00:30:00	TweetDeck	4	2
El actor Xavier López ‘Chabelo’ tuvo que ser operado de emergencia https://t.co/dJFg4umJwA https://t.co/ol34TkRAdY	1118669218789019648	114	2019-04-18 00:15:00	TweetDeck	76	40
Detienen a hombre con pipa de combustible robado en el Estado de México https://t.co/V1eWwHoTmQ https://t.co/hDJJj1zmSo	1118665191950966784	119	2019-04-17 23:59:00	TweetDeck	13	4
"Detienen a 60 aficionados del Ajax armados en Turín. 

Entre los objetos asegurados a los seguidores se encuentran… https://t.co/Wi7Umdd2LL"	1118661669050290183	139	2019-04-17 23:45:00	TweetDeck	9	1
La violencia no cede en la Ciudad de México. Presunto cómplice mata a pareja de colombianos dedicados al robo… https://t.co/D9dKTV5Bty	1118657894231097345	134	2019-04-17 23:30:00	TweetDeck	47	12
"LeBron James y Saúl ‘Canelo’ Álvarez colaborarán en un ambicioso proyecto. 

Aquí los detalles:… https://t.co/vSCjiyLLON"	1118654119177101312	120	2019-04-17 23:15:00	TweetDeck	15	2
"Sorpresa en el listado de los municipios más inseguros de México. Ya no es Ecatepec ni Ciudad Juárez ni Reynosa.

D… https://t.co/TXGkoEk32h"	1118650345398386690	140	2019-04-17 23:00:00	TweetDeck	10	8
Encuentran otro laboratorio clandestino de fentanilo en México, esta terrible droga que es potencialmente mortal… https://t.co/RIl9hDswIq	1118646569539076096	137	2019-04-17 22:45:00	TweetDeck	27	9
RT @ahope71: Según INEGI, se deterioró la percepción de seguridad en zonas urbanas en el primer trimestre de 2019. Con esto, se revirtió la…	1118644261883457536	140	2019-04-17 22:35:50	Twitter for iPhone	0	115
Todavía no les llama. Pero les llamará. https://t.co/mPP0xNEMPz	1118644230405152768	63	2019-04-17 22:35:42	Twitter for iPhone	217	97
Estimado @RicardoMonrealA empezando por el Senado cuya Junta de Coordinación Política presides. Saludos. https://t.co/jvEUIdbUkZ	1118643261047017477	128	2019-04-17 22:31:51	Twitter for iPhone	247	100
Consiguen reactivar los cerebros de varios cerdos... cuatro horas después de su muerte https://t.co/szCP1y4dpP https://t.co/b8KeaU22TF	1118642795663675392	134	2019-04-17 22:30:00	TweetDeck	36	13
Les digo... https://t.co/8O3896ke7f	1118642583604027393	35	2019-04-17 22:29:09	Twitter for iPhone	200	64
La Sedena dará mantenimiento a aviones de aerolíneas canadienses. Los detalles: https://t.co/9I7yzJlq33	1118639020341387266	103	2019-04-17 22:15:00	TweetDeck	15	2
Otra marca rota por la nueva temporada de Game of Thrones, pero estoy seguro de que es un récord que no les gustarí… https://t.co/w03H1PIyru	1118635999926448128	140	2019-04-17 22:03:00	TweetDeck	14	2
Este es mi canal en YouTube https://t.co/OPgR29K0ey https://t.co/TNv1jAy7OA	1118635246738530304	75	2019-04-17 22:00:00	TweetDeck	12	0
Manda mensaje a Pablo Lyle la viuda del hombre que murió a causa de un golpe del actor https://t.co/qLadTf3qsT https://t.co/Bp8ZxCjf0r	1118631470363545602	134	2019-04-17 21:45:00	TweetDeck	19	4
"#IMPORTANTE 

Se mantiene Fase 1 de la Contingencia Ambiental en el Valle de México https://t.co/slJFOUoIuK"	1118629656796651520	107	2019-04-17 21:37:47	TweetDeck	20	2
No es broma, un popular videojuego podría ayudar a reconstruir la catedral de Notre-Dame tras el incendio… https://t.co/D9DNh7gdYB	1118627696018448385	130	2019-04-17 21:30:00	TweetDeck	86	19
Se mantiene Fase 1 de Contingencia Atmosférica por Ozono en la Zona Metropolitana del Valle de México	1118627214776389632	101	2019-04-17 21:28:05	TweetDeck	27	5
Trump endurece política de EE.UU. en contra de Cuba https://t.co/rGAcXNEkX7	1118623920779857927	75	2019-04-17 21:15:00	TweetDeck	22	4
"#ÚLTIMAHORA 

La niña salvadoreña de 11 años no será deportada de los Estados Unidos a su país de origen. 

El repo… https://t.co/zsdFkzyEVv"	1118618132241944577	140	2019-04-17 20:52:00	Twitter Media Studio	17	8
Más de 30 hombres atacan comandancia en Chihuahua y dejan varios muertos https://t.co/Pgwb40Wqqo https://t.co/kLzD1vPwyc	1118616370776870912	120	2019-04-17 20:45:00	TweetDeck	19	14
RT @NTelevisa_com: Policías de la CDMX agredieron a un motociclista de una empresa que entrega comida a domicilio. En el video se observa a…	1118614382873804800	140	2019-04-17 20:37:06	Twitter for iPhone	0	29
¿Pues no que ya no...? #HabiaDicho https://t.co/UieTJhWAo4	1118614110202155010	58	2019-04-17 20:36:01	Twitter for iPhone	61	44
Asesinan en su casa a secretario particular del jefe del Estado Mayor durante la administración de Enrique Peña Nie… https://t.co/tfJc1mefT9	1118612596528177152	140	2019-04-17 20:30:00	TweetDeck	49	33
En Guerrero, perro ayuda a encontrar mariguana dentro de la mochila… de un policía 🤦‍♂️ https://t.co/6y0T1ta3n2 https://t.co/wDa29bMQZP	1118608820572319744	135	2019-04-17 20:15:00	TweetDeck	73	24
#VIDEO El momento en el que vehículo pierde el control y arrolla a una aficionada mientras cantaba alegremente. Imá… https://t.co/vRh4DBhUjt	1118605047393185792	140	2019-04-17 20:00:00	TweetDeck	8	2
Con la desaparición del salario desu presidenta el DIF de Atizapán ahorrará... ¡4 millones de pesos!… https://t.co/dIt85NdR9s	1118601281260490752	125	2019-04-17 19:45:02	TweetDeck	15	7
Posponen mesa de trabajo entre la SEP y CNTE https://t.co/mGBpMba2bd https://t.co/BBh2eXSsuK	1118597496815570944	92	2019-04-17 19:30:00	TweetDeck	9	4
Muere hombre en estación del Metrobús https://t.co/RuFzyDK4R7 https://t.co/BHD1cCzICn	1118593721552068608	85	2019-04-17 19:15:00	TweetDeck	1	4
Incidente vial termina en tragedia luego de que conductor atropelló al grupo de personas con las que discutía en la… https://t.co/qzTjK1dZSm	1118589951069712386	140	2019-04-17 19:00:01	TweetDeck	8	1
"Lanzan el último tráiler de ‘X-Men: Dark Phoenix’ antes del estreno de la película.

#VIDEO Aquí lo pueden ver:… https://t.co/9lVz8OcKw4"	1118586172073304068	136	2019-04-17 18:45:00	TweetDeck	33	2
Encuentran sin vida a la mujer que amenazó con atacar escuelas de Columbine https://t.co/HUMLGP4XTM https://t.co/O7svRtFmxc	1118584362826526725	123	2019-04-17 18:37:49	TweetDeck	23	2
Usted puede seguir en vivo en esta liga https://t.co/FySweMUUxP el noticiario de @lopezdoriga en @Radio_Formula y… https://t.co/EN6874Yf4U	1118582791040589825	138	2019-04-17 18:31:34	Twitter Web Client	10	1
Prohíben popular aplicación en todo un país por difusión de pornografía https://t.co/SWuk1wDXWG https://t.co/uP1m2n8KMu	1118581244315357184	119	2019-04-17 18:25:25	TweetDeck	19	4
La razón por la que la SCJN podría restringir la convivencia entre padres e hijos https://t.co/wNtkYe2Har https://t.co/lLnGrruuK5	1118575931357106177	129	2019-04-17 18:04:18	TweetDeck	7	2
Otro incendio en el Bosque de la Primavera https://t.co/EEuesmXnmr https://t.co/lV3yfwcK6q	1118571459771654144	90	2019-04-17 17:46:32	TweetDeck	16	11
Trump habla con el papa Francisco sobre incendio de Notre-Dame https://t.co/QaMvQnJ8aJ https://t.co/1gjbR6DSf8	1118567299030687745	110	2019-04-17 17:30:00	TweetDeck	13	2
Pese a política de austeridad, diputados han gastado más de 412 millones de pesos en seis meses, casi todo lo asign… https://t.co/WmMe2VXZFv	1118563522546491393	140	2019-04-17 17:15:00	TweetDeck	114	94
Todo sobre la protesta de maestros de la UAM en el Zócalo capitalino (VIDEO) https://t.co/kyUbfyVOGR https://t.co/gmS0QipszJ	1118561509322391552	124	2019-04-17 17:07:00	TweetDeck	10	1
⚠️ Alerta Amarilla por calor extremo en nueve alcaldías de la Ciudad de México https://t.co/a05M0SoaDi https://t.co/7e2u4XJLYQ	1118559747559571458	126	2019-04-17 17:00:00	TweetDeck	11	5
"RT @mileniotv: ▶ #MilenioAlMomento 

¡Al diablo con los que se alegran con el incendio de #NotreDame! ¡Dense cuenta de la magnitud de la tr…"	1118556364001959936	140	2019-04-17 16:46:33	Twitter for iPhone	0	51
Dramáticos momentos vivieron pasajeros de jet del gobierno alemán luego de que alas golpearan la pista al aterrizar… https://t.co/gxIX3Ssvkq	1118555972505440256	140	2019-04-17 16:45:00	TweetDeck	15	4
Leona ataca a hombre que ignoró reglas de seguridad en reserva (VIDEO) https://t.co/WZei8hG2F0 https://t.co/G7bvTtyY9e	1118553959101190144	118	2019-04-17 16:37:00	TweetDeck	24	5
"Los municipios más inseguros de México:
3.- Cancún
2.- Villahermosa
1.- https://t.co/NZYBDLo9P0 https://t.co/QfzN65PcKZ"	1118552197392846848	119	2019-04-17 16:30:00	TweetDeck	50	53
Por Fase 1 de Contingencia Ambiental, estos son los vehículos que deberán suspender su circulación el día de hoy https://t.co/tNLoobfxOF	1118550184684744704	136	2019-04-17 16:22:00	TweetDeck	27	4
#ÚLTIMAHORA Se mantiene Fase 1 de Contingencia Ambiental en El Valle de México https://t.co/tNLoobfxOF https://t.co/qzEX1Roqdc	1118548710693064704	126	2019-04-17 16:16:08	TweetDeck	25	20
Así la situación en la caseta de cobro de la México-Cuernavaca en Tlalpan https://t.co/UI3b0CziTP https://t.co/BnDjMy8mkU	1118544653823819776	121	2019-04-17 16:00:01	TweetDeck	32	28
"“Esta mañana ha sucedido este lamentable accidente: el presidente tomó la decisión de dispararse”.

Alan García mur… https://t.co/SOTOBf9y0y"	1118540873543798785	140	2019-04-17 15:45:00	TweetDeck	32	7
#AMPLIACIÓN Martín Vizcarra, presidente de Perú, confirma la muerte de Alan García https://t.co/DB4AbOPFUN	1118538552332021762	106	2019-04-17 15:35:46	TweetDeck	56	24
#ÚLTIMAHORA Ha muerto el expresidente peruano Alan García tras dispararse cuando policías intentaron detenerlo por… https://t.co/Wnqt2Ggzf3	1118538182855811073	139	2019-04-17 15:34:18	TweetDeck	120	79
Asesinan a mujer durante asalto en transporte público de Coacalco https://t.co/VXxKi1KtE2 https://t.co/VgTFYN9ydo	1118537099278520323	113	2019-04-17 15:30:00	TweetDeck	12	6
La inseguridad en el transporte público del Valle de México. Asesinan a mujer durante asalto a combi en Coacalco https://t.co/R6U0C2lJkH	1118537097990684672	136	2019-04-17 15:30:00	TweetDeck	39	30
¿Cuántas cuentas ha bloqueado la Unidad de Inteligencia Financiera de Hacienda por vínculos con lavado de dinero, c… https://t.co/4aczierXgn	1118533324492935169	140	2019-04-17 15:15:00	TweetDeck	14	11
Time incluye a Andrés Manuel López Obrador y a Yalitza Aparicio en su lista de las 100 personas más influyentes de… https://t.co/teGyz8wWuL	1118529550462406657	139	2019-04-17 15:00:00	TweetDeck	117	17
"Retiran de las tiendas las galletas de la marca Chips Ahoy!, por contener “ingrediente solidificado inesperado” 

D… https://t.co/jGCFVSShzg"	1118526558375796736	140	2019-04-17 14:48:07	TweetDeck	50	39
"#ÚLTIMAHORA 

¡Ya hay fecha confirmada! A horario estelar el próximo juego de la NFL en México. 

Detalles:… https://t.co/c96Gv4qsYl"	1118523793578708994	132	2019-04-17 14:37:08	TweetDeck	56	12
Al mismo tiempo que Notre-Dame ardía, otro sitio religioso se incendió... en Jerusalén https://t.co/0dTB7fe9fq https://t.co/Rn0GStAC55	1118523760049410049	134	2019-04-17 14:37:00	TweetDeck	66	16
Tomen nota. Este es el horario especial con el que operará el transporte público del Valle de México por Días Santo… https://t.co/sMaxTO80Rk	1118521998638866432	140	2019-04-17 14:30:00	TweetDeck	10	0
Manda mensaje a Pablo Lyle la viuda del hombre que murió a causa de un golpe del actor https://t.co/qLadTfl1kr https://t.co/CBl2Erb7Io	1118519223054024704	134	2019-04-17 14:18:58	TweetDeck	8	2
El inminente problema que podría retrasar la reconstrucción de la catedral de Notre-Dame https://t.co/yOeTBo1dzd https://t.co/EtCHAKWeaq	1118515707774418944	136	2019-04-17 14:05:00	TweetDeck	17	1
Los espero también en Instagram https://t.co/FTqWB4BJNP https://t.co/Mn67USaoBV	1118514456919547907	79	2019-04-17 14:00:02	TweetDeck	9	1
Se cumplen cinco años de la muerte del gran Gabriel García Márquez, uno de los escritores más importantes del Siglo… https://t.co/WNRVw1Gkjv	1118511646282936326	140	2019-04-17 13:48:52	TweetDeck	111	36
López Obrador revela la razón de haber emitido el polémico memorándum para dejar sin efecto la Reforma Educativa… https://t.co/iGqB9gGBfv	1118509334349017088	137	2019-04-17 13:39:40	TweetDeck	17	10
Este miércoles se mantiene la Fase 1 de Contingencia Ambiental en el Valle de México https://t.co/cQGDhXnSRB	1118507519716888577	108	2019-04-17 13:32:28	TweetDeck	16	8
El secretario personal de Alan García confirmó que tras notar la presencia del fiscal en su domicilio, el expreside… https://t.co/EnjqB3n2ce	1118503326050447366	140	2019-04-17 13:15:48	TweetDeck	58	16
"#ÚLTIMAHORA

El expresidente Alan García se disparó antes de ser detenido por el caso Odebrecht… https://t.co/yawD1MCJV3"	1118502466239094785	120	2019-04-17 13:12:23	TweetDeck	125	81
"#IMPORTANTE 

Revela rector cuánto tiempo estará cerrada al público la catedral de Notre-Dame… https://t.co/XvD0GsGneR"	1118499639756374017	118	2019-04-17 13:01:09	TweetDeck	13	4
"Reitera López Obrador: ""hice el compromiso de que iba a cancelar la Reforma Educativa. Y lo estoy cumpliendo."" 

EN… https://t.co/RbxLbaHYvq"	1118497318032920576	140	2019-04-17 12:51:55	TweetDeck	20	2
Sobre el memorándum de la Reforma Educativa, López Obrador reiteró que si bien generó múltiples opiniones al respec… https://t.co/wc7fARUeed	1118496419923603456	140	2019-04-17 12:48:21	TweetDeck	17	3
Sobre el caso de la periodista Lydia Cacho, López Obrador celebra que las autoridades estén dando trámite y proceda… https://t.co/ByJPhQMHOd	1118495535252402176	140	2019-04-17 12:44:50	TweetDeck	5	2
Estos son los criterios técnicos de selección que empleará el gobierno federal para asignar la comunicación oficial… https://t.co/MgFL8pxW0l	1118492031318233088	140	2019-04-17 12:30:55	TweetDeck	7	4
Francia lanza concurso para reconstruir aguja de la catedral de Notre-Dame https://t.co/4orKvmDEDM	1118491799713140743	98	2019-04-17 12:30:00	TweetDeck	20	3
"El gobierno utilizará el 100 por ciento de los Tiempos Oficiales en radio y televisión, informa Jesús Ramírez. 

EN… https://t.co/CGBKawDztO"	1118490794300596224	140	2019-04-17 12:26:00	TweetDeck	1	0
"Revela el vocero del gobierno, Jesús Ramírez, el gasto en publicidad oficial del gobierno federal desde 2007. 

EN… https://t.co/1lrEW6u0t1"	1118489956312203265	139	2019-04-17 12:22:40	TweetDeck	6	2
Jesús Ramírez afirma que el objetivo de la política de comunicación es incentivar el impacto de la acción gubername… https://t.co/u9iV3t79lX	1118488796624855043	140	2019-04-17 12:18:04	TweetDeck	3	3
Persiste mala calidad del aire en el Valle de México. Se mantiene la Fase 1 de Contingencia Ambiental… https://t.co/CsOaLNMsKX	1118488024868724736	126	2019-04-17 12:15:00	TweetDeck	6	2
Toma la palabra Jesús Ramírez, el vocero del Gobierno de la República, para presentar la política de comunicación s… https://t.co/zbQYjSiEZu	1118487472042729472	140	2019-04-17 12:12:48	TweetDeck	4	0
López Obrador anuncia que, como parte de la política de austeridad, el gobierno federal disminuirá en un 50 por cie… https://t.co/kUhcDAf9zS	1118486356135534593	140	2019-04-17 12:08:22	TweetDeck	9	3
#EnVivo Inicia conferencia matutina de López Obrador. La última de la semana https://t.co/2x8eOF9Qxv https://t.co/qj5HiZp4ic	1118485724355973120	124	2019-04-17 12:05:51	TweetDeck	24	0
Estos son los vehículos que no circulan este miércoles: https://t.co/CcWKOheU9h	1118484252390244352	79	2019-04-17 12:00:00	TweetDeck	8	2
El ministro en retiro José Ramon Cossío subrayó que el memorándum de López Obrador para dejar sin efecto la Reforma… https://t.co/AmHaka4zco	1118481733509369857	140	2019-04-17 11:50:00	TweetDeck	480	148
Guillermo Zúñiga renuncia a la Comisión Reguladora de Energía https://t.co/qYpkFrZeQ1 https://t.co/uCl28fNoUo	1118479217275150341	109	2019-04-17 11:40:00	TweetDeck	9	7
La Canacar afirmó que en México se paga el doble de impuestos en la transportación, en comparación con Estados Unid… https://t.co/vFKCTqVEcr	1118474183497830401	140	2019-04-17 11:20:00	TweetDeck	56	33
Nueva campanada del Ajax en Europa https://t.co/AxuHfff5tr https://t.co/GnEOWjXwCm	1118471415584391168	82	2019-04-17 11:09:00	TweetDeck	11	1
Buen día a todos	1118469157035626496	16	2019-04-17 11:00:01	TweetDeck	243	10
