Tweets	id	len	date	source	likes	rt
Simon Zebo sets up a brilliant try for Keith Earls in Munster v Edinburgh Pro14 Rugby Quarterfinal via /r/sports https://t.co/ZSsMWD7o8h	993826910974173184	136	2018-05-08 12:16:14	IFTTT	0	0
Filip Forsberg with an absolutely incredible between the legs goal via /r/sports https://t.co/92cqM0I0zS	993736185276137473	104	2018-05-08 06:15:43	IFTTT	0	0
Kuznetsov's Goal Makes the Capitals the first DC Sports Team to Make the Conference Final in 20 Years via /r/sports https://t.co/NhJfufaeTX	993714716278181888	139	2018-05-08 04:50:25	IFTTT	0	0
A day I never thought would come via /r/sports https://t.co/mm5Y9orT1J	993714714554327040	70	2018-05-08 04:50:24	IFTTT	0	0
The Mountain from Game of Thrones Wins World’s Strongest Man Title via /r/sports https://t.co/op9XQ3QvVh	993681933296177152	104	2018-05-08 02:40:09	IFTTT	0	0
"University of South Dakota pole vaulter breaks NCAA D1 record at 19' 2"". He is now 3rd best in the world. via /r/sp… https://t.co/vwb656YexH"	993674400225529856	140	2018-05-08 02:10:13	IFTTT	0	0
Mark Williams becomes world snooker champion. Keeps promise to do press conference naked. via /r/sports https://t.co/dTbJakQQLV	993619153717288962	127	2018-05-07 22:30:41	IFTTT	0	0
Piscotty’s mom passes away after battle with ALS. Cards &amp; A's helped him go home. ESPN made this touching video via… https://t.co/yORiScdZxl	993609036829462529	144	2018-05-07 21:50:29	IFTTT	0	0
NHL Player Brad Marchand Stops Licking Opponents, On League's Orders via /r/sports https://t.co/88n6h0LHey	993602673466380290	106	2018-05-07 21:25:12	IFTTT	0	0
Bruce Willis cast as Mike Tyson trainer Cus D’Amato in the biopic Cornerman via /r/sports https://t.co/9m8ZcpRcUS	993587574949208064	113	2018-05-07 20:25:12	IFTTT	0	0
Since 1998, the 4 major DC Sports teams (Caps, Nats, Skins and Wiz) have played 13 playoff games in which a win mea… https://t.co/9S4eRRNvTW	993572559328366592	140	2018-05-07 19:25:32	IFTTT	0	0
Bleeding Out | By Clint Malarchuk via /r/sports https://t.co/kEFyh47duS	993564954732236802	71	2018-05-07 18:55:19	IFTTT	0	0
Baby Ducks found on Fowl Line during Baseball Game via /r/sports https://t.co/D1mwaZLKsk	993564952786030593	88	2018-05-07 18:55:18	IFTTT	0	0
Looks like there's more than one of these rolling around Cincinatti. Are there other cities out there with these ki… https://t.co/y7I4vQrU7G	993515899847151622	140	2018-05-07 15:40:23	IFTTT	0	0
Every hit in Ichiros 18 year career via /r/sports https://t.co/v7vwqy8jBS	993515897036922880	73	2018-05-07 15:40:23	IFTTT	0	0
Woman wins $1.2 million on $18 bet that included Kentucky Derby via /r/sports https://t.co/3PBiWB7vXM	993487016720560128	101	2018-05-07 13:45:37	IFTTT	0	0
Two-time cancer survivor Joe Thompson scores late goal to keep Rochdale A.F.C. out of relegation via /r/sports https://t.co/GpQKfr2sd3	993464431832072193	134	2018-05-07 12:15:52	IFTTT	0	0
Feeling a rookies's heartbeat before his debut via /r/sports https://t.co/2FQwQrft6w	993413943732396032	84	2018-05-07 08:55:15	IFTTT	0	0
Mark Williams attempts to pot the pink ball with his eyes closed at the Final of the Snooker World Championship [Sp… https://t.co/RAVsKfptF0	993391310496296960	140	2018-05-07 07:25:19	IFTTT	0	0
Alaska Nanooks 2010 Hockey Intro via /r/sports https://t.co/xiFLbU8ZYs	993352383194456064	70	2018-05-07 04:50:38	IFTTT	0	0
Almost 5% of County Leitrim has travelled to New York for today's Connacht Gaelic football championship opener via… https://t.co/o2PU2d3OB9	993352381365719040	139	2018-05-07 04:50:37	IFTTT	0	0
Yadier Molina out a month after taking a 102 MPH foul tip in the groin via /r/sports https://t.co/VYruMLKJt2	993352379520208896	108	2018-05-07 04:50:37	IFTTT	0	0
102mph foul tip right in the beans via /r/sports https://t.co/qpObjtZVVv	993352377683017728	72	2018-05-07 04:50:37	IFTTT	0	0
Incredible Reflexes by Fighter Rafael Fiziev During a Kickboxing Match in Thailand via /r/sports https://t.co/hZGzpGiwNs	993352375271378944	120	2018-05-07 04:50:36	IFTTT	0	0
Incredible shot by Mark Williams at the World Snooker Championship via /r/sports https://t.co/6QcxD85R0L	993312062607646720	104	2018-05-07 02:10:25	IFTTT	0	0
LeBron’s game 3 buzzer beater make all top 10 plays via /r/sports https://t.co/MnO0OeQJ7G	993266720277065729	89	2018-05-06 23:10:14	IFTTT	0	0
76ers launch the confetti too early vs Boston. via /r/sports https://t.co/0nbodAPLDA	993251581872300032	84	2018-05-06 22:10:05	IFTTT	0	0
"""I've seen him shoot that shot countless times at shootaround when he's just like messing around. He'll shoot all t… https://t.co/A9Nn1Hq43N"	993227727686823936	140	2018-05-06 20:35:18	IFTTT	0	0
Dustin Pedroia goes Full Ninja to score a run via /r/sports https://t.co/KCF4J699rL	993227725052792838	83	2018-05-06 20:35:17	IFTTT	0	0
Feeling a rookies's heartbeat before his debut via /r/sports https://t.co/2FQwQrft6w	993210101359050753	84	2018-05-06 19:25:15	IFTTT	0	0
Ichiro goes Full Ninja to score a run via /r/sports https://t.co/n5ZtHUu1di	993182408785694721	75	2018-05-06 17:35:13	IFTTT	0	0
Ian Wright meets his former teacher, who supported him during his troubled youth and got him into football, after o… https://t.co/4kXl5yMgjg	993145906491994112	140	2018-05-06 15:10:10	IFTTT	0	0
Ridiculously photogenic hurdler via /r/sports https://t.co/BNRYjrnHNk	993130838652080128	69	2018-05-06 14:10:18	IFTTT	0	0
Breaking: Sir Alex Ferguson Former Manchester United boss has emergency surgery via /r/sports https://t.co/qfP2q5KeKw	993114584193134592	117	2018-05-06 13:05:42	IFTTT	0	0
Lebrons Plan 🙏 via /r/sports https://t.co/UWskJ9I3ry	993051536002568193	52	2018-05-06 08:55:10	IFTTT	0	0
St. Louis Cardinals catcher Yadier Molina forced to leave today's game versus the Cubs after being hit by foul ball… https://t.co/jD7lRZSQNK	993011506911563776	140	2018-05-06 06:16:07	IFTTT	1	0
LeBron James makes a buzzer beater to put the Cavaliers up 3-0 on the Raptors via /r/sports https://t.co/aPfnkkUpTa	992989977905594368	115	2018-05-06 04:50:34	IFTTT	0	0
Jim Thorpe, My Great Great Grandfather via /r/sports https://t.co/jvHc5G3wpb	992949689900290049	76	2018-05-06 02:10:28	IFTTT	0	0
Justify wins the 144th Kentucky Derby via /r/sports https://t.co/IDSg9jv2C5	992919460599287808	75	2018-05-06 00:10:21	IFTTT	0	0
Former Kentucky Derby winner American Pharoah has sex 3 times every day &amp; his owners charge a $200,000 fee per impr… https://t.co/8l3OtOMGnR	992911626092384256	144	2018-05-05 23:39:13	IFTTT	0	0
1993 - Brand new Florida Marlins franchise has the grounds crew attempt to cover the infield with a tarp during a r… https://t.co/PSDZUPZ07k	992902823460433922	140	2018-05-05 23:04:15	IFTTT	0	0
Found the Bengals bandwagon via /r/sports https://t.co/7vvJuEKWJ5	992902821182832640	65	2018-05-05 23:04:14	IFTTT	0	0
Sir Alex Ferguson: Former Manchester United boss has emergency surgery via /r/sports https://t.co/xi6T9RSjtH	992886534415273989	108	2018-05-05 21:59:31	IFTTT	0	0
Playoff Intensity via /r/sports https://t.co/sDVirvnG5v	992856283106725890	55	2018-05-05 19:59:18	IFTTT	0	0
Golden Knights hold off Sharks in Game 5, take lead in series via /r/sports https://t.co/rw6Pj7VqDv	992802139964665856	99	2018-05-05 16:24:10	IFTTT	0	0
Angels slugger Albert Pujols joins 3,000-hit club via /r/sports https://t.co/NT6xB6xVyX	992709041829875714	87	2018-05-05 10:14:13	IFTTT	0	0
Spurs' Becky Hammon to become first female to interview for head coaching gig in NBA via /r/sports https://t.co/HN7ndZeHjm	992648633676959746	122	2018-05-05 06:14:11	IFTTT	0	0
Albert Pujols. 32nd player in MLB history with 3,000 hits. You deserve a standing ovation. via /r/sports https://t.co/3BJuR2vuB7	992648631965581312	128	2018-05-05 06:14:11	IFTTT	0	0
Albert Pujols becomes the 4th player in MLB history to have at least 3,000 hits and 600 homeruns via /r/sports https://t.co/tOIldE6Kfy	992648630359162880	134	2018-05-05 06:14:10	IFTTT	0	0
Guy gets trapped under tarp being put over raining Baseball field via /r/sports https://t.co/OBCkPxzUOe	992648628685721600	103	2018-05-05 06:14:10	IFTTT	0	0
2 minutes for licking? via /r/sports https://t.co/Dsd8MQM5Z8	992618476022923264	60	2018-05-05 04:14:21	IFTTT	0	0
Even a Little Exercise Might Make Us Happier via /r/sports https://t.co/769VdjTamf	992578146359705601	82	2018-05-05 01:34:05	IFTTT	0	0
Night Skiing in LED Light Suits via /r/sports https://t.co/ha04hpc0kG	992549252172800002	69	2018-05-04 23:39:17	IFTTT	0	0
YES Network cameras show what appears to be a foreign substance on the cleat of Lance McCullers via /r/sports https://t.co/SFAnx8xEMt	992540471367958528	133	2018-05-04 23:04:23	IFTTT	0	0
Yankees giving out Aaron Judge bobbleheads for Star Wars night via /r/sports https://t.co/NMairsjD95	992540469358972928	100	2018-05-04 23:04:23	IFTTT	0	0
"What are your favourite sports podcasts? via /r/sports

I'm just now getting into podcasts and listening to the pod… https://t.co/ObOHP3ecFs"	992527867643867136	140	2018-05-04 22:14:18	IFTTT	0	0
Alex Ovechkin fails to record a shot in Game 4 loss via /r/sports https://t.co/xnOHYB13Kj	992524087242223624	89	2018-05-04 21:59:17	IFTTT	0	0
I went to Akron and Cleveland to make a short film about LeBron’s impact. I thought people here might enjoy it via… https://t.co/CkT08ul63f	992524085233111040	139	2018-05-04 21:59:16	IFTTT	0	0
The Celtics are not going away via /r/sports https://t.co/7JPThebp3l	992493886219186179	68	2018-05-04 19:59:16	IFTTT	0	0
Back to back buzzer beaters? The bank is always open via /r/sports https://t.co/Yq2S4o6pYm	992476282293248003	90	2018-05-04 18:49:19	IFTTT	0	0
From Elizabethton High School standout to NFL Legend, Jason Witten via /r/sports https://t.co/KrAzSHF1Es	992476280246493184	104	2018-05-04 18:49:19	IFTTT	0	0
Italy’s contribution to World Cup 2018 via /r/sports https://t.co/onYZDf9fBf	992459869709008898	76	2018-05-04 17:44:06	IFTTT	0	0
Yankees-Red Sox to play 2019 series in London via /r/sports https://t.co/2D15MeTxIW	992439777940164608	83	2018-05-04 16:24:16	IFTTT	0	0
Day 3 of Glass Blown Open - Two Disc Golf pros both almost ace the same 426' hole, back to back. via /r/sports https://t.co/ph6MrXg3Ue	992425999420809216	134	2018-05-04 15:29:31	IFTTT	0	0
Nashville's Pekka Rinne stick handle save via /r/sports https://t.co/cXDdZ96yPr	992425996728008705	79	2018-05-04 15:29:30	IFTTT	0	0
Playing Football With Shock Collars via /r/sports https://t.co/9zWuLucecF	992412122603769857	73	2018-05-04 14:34:22	IFTTT	0	0
"Robert Kraft about to drop his debut album ""5 Rings and Championship Things"" with the hit singles ""You Mad Bro? and… https://t.co/Yh1c7ye7bL"	992412120796028929	140	2018-05-04 14:34:22	IFTTT	0	0
Lakers head coach, Luke Walton, is a beast at beach volleyball. Highlights from his recent 4 v 4 match with profess… https://t.co/cCgsMQbm7L	992379480999190528	140	2018-05-04 12:24:40	IFTTT	0	0
Ohio State vs. Johns Hopkins Lacrosse fight via /r/sports https://t.co/zx27DzxFBY	992339123879981057	81	2018-05-04 09:44:18	IFTTT	0	0
Mets let deGrom pitch through pain: Now season rides on MRI via /r/sports https://t.co/oiC0k13wHC	992293831037960193	97	2018-05-04 06:44:19	IFTTT	0	0
Don't heckle James Harden via /r/sports https://t.co/5wVJikPkQV	992210743566196737	63	2018-05-04 01:14:10	IFTTT	0	0
Blocking Pucks via /r/sports https://t.co/HBOZf8ytWR	992186911698669570	52	2018-05-03 23:39:28	IFTTT	0	0
Real Madrid v Liverpool: Champions League finalists via /r/sports https://t.co/KZxlPpa7Bc	992178104528461824	89	2018-05-03 23:04:28	IFTTT	0	0
Mariners' Ichiro Suzuki to enter front-office role for rest of '18 season via /r/sports https://t.co/x01O6Dqb2S	992178099839229957	111	2018-05-03 23:04:27	IFTTT	0	0
Report: Redskins cheerleaders required to pose topless for 2013 photo shoot; required to take weeklong upaid trip t… https://t.co/Yc721GdZRC	992161695341608966	140	2018-05-03 21:59:16	IFTTT	0	0
Study: NFL Provides Worst In-Stadium Experience Across Pro Sports via /r/sports https://t.co/YhO8mmyUxv	992161693454290944	103	2018-05-03 21:59:15	IFTTT	0	0
Report: Shazier has $8.72M salary turned into bonus, will get money immediately via /r/sports https://t.co/uxlwoliGM4	992097523446640640	117	2018-05-03 17:44:16	IFTTT	0	0
North- &amp; South Korea decline playing eachother in Table Tennis Worlds Quarterfinal in favor of advancing as one uni… https://t.co/1IOab8LVjw	992077418960707584	144	2018-05-03 16:24:23	IFTTT	0	0
Playing football in bird's eyes view with VR glasses via /r/sports https://t.co/ekWgFC2wtq	992077416435716097	90	2018-05-03 16:24:22	IFTTT	0	0
Donovan Mitchell puts it back via /r/sports https://t.co/reM2ueM4nl	992063618668736513	67	2018-05-03 15:29:32	IFTTT	0	0
A Florida High School water polo team won in triple overtime to advance to the state championship, only to have tha… https://t.co/XRayuTZr4m	992052264847147012	140	2018-05-03 14:44:26	IFTTT	0	0
Amazingly Accurate Flight Comparison, 426ft. Drew Gibson (Yellow) &amp; Simon Lizotte (Green) via /r/sports https://t.co/PwuE4rpk5Y	992052262318018560	131	2018-05-03 14:44:25	IFTTT	0	0
The Sixers beat everyone towards the end of the regular season, including the Broncos. via /r/sports https://t.co/yUaOqiI1FN	991931379024875520	124	2018-05-03 06:44:04	IFTTT	0	0
Yoenis Céspedes breaks his chain sliding into 2nd base scattering diamonds over the infield via /r/sports https://t.co/z97C7gXSEy	991879888540876800	129	2018-05-03 03:19:28	IFTTT	0	0
UDFA bonus story via /r/sports https://t.co/aYij2TDWco	991863593300844544	54	2018-05-03 02:14:43	IFTTT	0	0
Justin Thomas helps a golf fan propose via /r/sports https://t.co/pLNWYy7bVg	991848379000000512	76	2018-05-03 01:14:15	IFTTT	0	0
Jenga Trick via /r/sports https://t.co/ddBl8FOa8E	991828235901132801	49	2018-05-02 23:54:13	IFTTT	0	0
Gustafsson lands three clean uppercuts on Teixeira then finishes him with a right hand (crosspost) via /r/sports https://t.co/FMldEsOB3x	991820210754736129	136	2018-05-02 23:22:20	IFTTT	0	0
James Milner own goal (Liverpool v Roma) via /r/sports https://t.co/sOswOKPAKE	991820208582078465	78	2018-05-02 23:22:19	IFTTT	0	0
Raptors Fans Chant “Khloe” While Tristan Thompson Shoots Free-Throws via /r/sports https://t.co/ZCwqrU4Hj8	991797578131009537	106	2018-05-02 21:52:23	IFTTT	0	0
Redskins Cheerleaders Describe a Trip to Costa Rica That Crossed a Line via /r/sports https://t.co/r7rDI5yh67	991797575945785344	109	2018-05-02 21:52:23	IFTTT	0	0
Brilliant shots by Judd Trump to stage an unlikely comeback clearance in a frame in the World Snooker Championship.… https://t.co/NCECBDWC9t	991785061199511554	140	2018-05-02 21:02:39	IFTTT	0	0
Duke Kahanamoku, the man who popularized surfing around the world, in Hawaii, 1920 via /r/sports https://t.co/gHR3UwDdfo	991785056871047168	120	2018-05-02 21:02:38	IFTTT	0	0
My fellow football redditors...I played Spot the Ball: Champions League and i got 9th place via /r/sports https://t.co/Pw3QKZS9dz	991745976426737664	129	2018-05-02 18:27:21	IFTTT	0	0
The general theme in pittsburgh... via /r/sports https://t.co/Oe3mbyyquj	991732080877895681	72	2018-05-02 17:32:08	IFTTT	0	0
19 Year old Rookie Makes NHL Look Like a Beer League via /r/sports https://t.co/steWGLiuQN	991699378791436288	90	2018-05-02 15:22:11	IFTTT	0	0
Skipping in a 380ft shot - Eagle McMahon via /r/sports https://t.co/TVegtZhBI3	991699376979546113	78	2018-05-02 15:22:11	IFTTT	0	0
This ridiculous foul that happened during tonight’s New Orleans and Golden State game via /r/sports https://t.co/VDcVhCbqRH	991674231229419525	123	2018-05-02 13:42:15	IFTTT	0	0
Fancy flying while filming a rally car via /r/sports https://t.co/zIYymBbxWB	991657882436370438	76	2018-05-02 12:37:17	IFTTT	0	0
Ken Giles punches himself in the face after giving up a 3 run homer to the Yankees via /r/sports https://t.co/TW5VapM33z	991591202171576320	120	2018-05-02 08:12:20	IFTTT	0	0
