id,text,len,date,source,likes,rt
1118790042539954177,"Es posible que te hayan recomendado que si no puedes dormir, te quedes acostado en la cama con los ojos cerrados ha… https://t.co/iOoQSFyZeE",140,2019-04-18 08:15:06,SocialFlow,21,14
1118789684962975744,Científicos detectan la primera molécula del Big Bang en el espacio: https://t.co/bXETFLkGcj,92,2019-04-18 08:13:41,SocialFlow,211,106
1118788773805002763,"La entrevista de Alan García la noche antes de suicidarse: ""Creo en la vida después de la muerte"": https://t.co/FvQYdPAEj8",122,2019-04-18 08:10:04,SocialFlow,16,16
1118787515794829313,La comunidad científica está molesta por la venta en el sitio de subastas por internet eBay de un fósil de un Tyran… https://t.co/XxxIdoXJ71,140,2019-04-18 08:05:04,SocialFlow,29,14
1118786266055749633,Lo que se vivió el miércoles en Manchester fue un partido sin igual: https://t.co/fSwOzVKXoK,92,2019-04-18 08:00:06,SocialFlow,9,2
1118785004342075392,Corea del Norte prueba arma 'táctica': ¿mensaje para Estados Unidos?: https://t.co/wVGtntYt8t,93,2019-04-18 07:55:05,SocialFlow,16,14
1118783732025036800,La muerte de Alan García tomó a muchos por sorpresa. Estas fueron algunas de las reacciones: https://t.co/4kEHyDQAW6,116,2019-04-18 07:50:02,SocialFlow,11,5
1118782990631559168,"SpaceX aterrizó sus tres propulsores Falcon Heavy sin fallas, pero un mar tormentoso derribó uno de ellos: https://t.co/3TxDwW6gbb",130,2019-04-18 07:47:05,SocialFlow,22,6
1118782481048768512,La SEC dice que Musk estaría desacatando acuerdo de que sus abogados deben revisar previamente sus tuits: https://t.co/AVpWeNgXLT,129,2019-04-18 07:45:04,SocialFlow,4,3
1118781231808811008,Un sentimiento de inquietante expectativa se cierne sobre Washington antes de la publicación de una versión editada… https://t.co/TEVsKXDgV4,140,2019-04-18 07:40:06,SocialFlow,12,10
1118780459473874945,"Este 20 de abril se cumplen 20 años de Columbine, la matanza que marcó un hito en ataques a escuelas de EE.UU. https://t.co/71w4JmTsHI",134,2019-04-18 07:37:02,SocialFlow,20,14
1118780458978951168,"Trump veta la resolución del Congreso sobre la Guerra de Yemen, su segundo veto desde que es presidente: https://t.co/oBIy4GVUDy",128,2019-04-18 07:37:02,SocialFlow,8,5
1118779973773529088,Una pareja australiana sobrevivió más de un día entero atascada con su vehículo en medio de un pantano infestado de… https://t.co/FxALHwZ0sV,140,2019-04-18 07:35:06,SocialFlow,73,24
1118778730330120192,"Alan García fue acusado de recibir sobornos de una de las constructoras más grandes de América Latina, Odebrecht. É… https://t.co/5gGlXgDaAX",140,2019-04-18 07:30:09,SocialFlow,12,6
1118777438044082176,"El nuevo clip de la banda BTS, ""Boy with Lov,"" se convirtió en el video más visto en YouTube en las primeras 24 hor… https://t.co/Lcg4uRbEYF",140,2019-04-18 07:25:01,SocialFlow,34,11
1118776714279182336,"AMLO, Juan Guaidó, Yalitza Aparicio y Jair Bolsonaro, entre los 100 más influyentes de la revista Time: https://t.co/9u7iDCZ74Z",127,2019-04-18 07:22:09,SocialFlow,180,28
1118776187914993664,"Jorge Arreaza dijo que Colombia y Estados Unidos están tratando de ""distraer"" la atención pública hacia Venezuela p… https://t.co/cjKLvCLI6H",140,2019-04-18 07:20:03,SocialFlow,5,6
1118774936926085120,Las primeras imágenes tomadas con un dron tras el incendio en la catedral de Notre Dame muestran la dimensión de la… https://t.co/zEFK5E66LI,140,2019-04-18 07:15:05,SocialFlow,33,16
1118773678433538048,"Alan García fue presidente de Perú en dos periodos, primero de 1985 a 1990 y luego de 2006 a 2011: https://t.co/VVSol5Zgfo",122,2019-04-18 07:10:05,SocialFlow,39,15
1118772402496913409,Migrantes provenientes de África se unen a la caravana en busca de asilo en México: https://t.co/Xq9mv2zbHz,107,2019-04-18 07:05:01,SocialFlow,18,12
1118771169027600384,"Hallan muerta a Sol Pais, la mujer ""obsesionada"" con Columbine que hizo amenazas contra escuelas: https://t.co/Uz3ZrYCo6T",121,2019-04-18 07:00:07,SocialFlow,15,8
1118769893225136128,Una ballena de mas de 10 toneladas y ocho metros de largo murió en una playa de Santiago de Chile tras pasar más de… https://t.co/KV3LaUKwif,140,2019-04-18 06:55:02,SocialFlow,39,25
1118768637974859776,Alan García se quitó la vida disparándose en la cabeza: https://t.co/c0RY3KFtRl,79,2019-04-18 06:50:03,SocialFlow,21,9
1118767384645570560,Hallan muerta a mujer que desató el pánico a días del aniversario 20 de la masacre de Columbine: https://t.co/57qASdg0Ri,120,2019-04-18 06:45:04,SocialFlow,20,14
1118766129718157312,EE.UU. permitirá demandas contra compañías extranjeras que negocian con el gobierno de Cuba: https://t.co/rBSUGnVmlo,116,2019-04-18 06:40:05,SocialFlow,45,33
1118764860567969792,"Cuba, Venezuela y Nicaragua reciben sanciones y restricciones de EE.UU.: https://t.co/MrWs23EVzb",96,2019-04-18 06:35:03,SocialFlow,85,45
1118763614188527617,"Hace cuatro años, un historiador usó láseres para hacer mapas digitales de Notre Dame; su trabajo podría ayudar a s… https://t.co/xYbwyjyflw",140,2019-04-18 06:30:05,SocialFlow,122,45
1118762343847092225,En Nicaragua se cumple un año de las manifestaciones contra el Gobierno de Daniel Ortega que han sacudido el país y… https://t.co/kqonqiNlvL,140,2019-04-18 06:25:03,SocialFlow,89,56
1118761098415620098,"Durante tres días, la tormenta afectará a 91 millones de personas y se desarrollará a lo largo de aproximadamente 2… https://t.co/oMwt7V0q6m",140,2019-04-18 06:20:06,SocialFlow,69,45
1118759838899564544,¿Qué valor tiene el memorándum que AMLO firmó contra la reforma educativa de Peña Nieto?: https://t.co/gFZ3OyBHwq,113,2019-04-18 06:15:05,SocialFlow,18,10
1118758579224367104,¿Dejarla como estaba antes o incluir algunos cambios? ¿Cómo debería ser la reconstrucción de la catedral de Notre D… https://t.co/UVik2Z9V4Q,140,2019-04-18 06:10:05,SocialFlow,45,23
1118756075904413696,"Un hombre de 71 años de Louisiana fue arrestado por 100 cargos preliminares de violación en primer grado, acusado d… https://t.co/ULsUATDOg3",140,2019-04-18 06:00:08,SocialFlow,32,20
1118753532893642753,Un hombre muere de un disparo después de accionar por accidente una pistola que guardaba en la bolsa de los pañales… https://t.co/InhUsImN4r,140,2019-04-18 05:50:02,SocialFlow,34,18
1118751030274134016,"Andrea Norton, de 20 años, posaba para una foto en un parque nacional de EE.UU. cuando cayó desde una altura de 30… https://t.co/NnHUzvStiB",139,2019-04-18 05:40:05,SocialFlow,123,87
1118748581287034880,"ÚLTIMA HORA 
Un sismo de magnitud 6,0 sacudió este jueves la costa este de Taiwán, de acuerdo con un reporte prelim… https://t.co/7lIDZbS6GF",140,2019-04-18 05:30:21,SocialFlow,196,180
1118748517122625536,Una barra de hierro atravesó la cabeza de un obrero indio y sobrevivió: https://t.co/pouksCk9Zh,95,2019-04-18 05:30:06,SocialFlow,41,13
1118745996643721217,Cada envío de cocaína desde Sudamérica es tan lucrativo que los aviones que usan los contrabandistas son baratos en… https://t.co/Ce2mn4IDfu,140,2019-04-18 05:20:05,SocialFlow,260,267
1118744989020971008,Para desvelados: 10 cosas equivocadas que pensabas que eran buenas para dormir (pero te pueden enfermar): https://t.co/OBxMM0WOgp,129,2019-04-18 05:16:05,SocialFlow,70,37
1118742220612542465,"Para el exalcalde venezolano Vicencio Scarano, cuando un régimen se mantiene a base del tráfico de estupefacientes,… https://t.co/JxMmb5Mx2j",140,2019-04-18 05:05:05,SocialFlow,35,20
1118740965458677765,Estados Unidos dio un golpe de gracia a la deteriorada economía de Cuba. El gobierno Trump anunció la entrada en vi… https://t.co/LQBKMvqRHj,140,2019-04-18 05:00:06,SocialFlow,62,39
1118739703178649600,"El gobierno de Estados Unidos impuso sanciones contra el Banco Central de Venezuela, lo que despertó una reacción i… https://t.co/YYhsg3b2lY",140,2019-04-18 04:55:05,SocialFlow,98,53
1118738443104923648,"Mauricio Mulder, amigo de Alan García y congresista peruano, aseveró que el expresidente tuvo ""un acto de dignidad""… https://t.co/jLB52XAeok",140,2019-04-18 04:50:04,SocialFlow,95,48
1118737188496261120,"E congresista y amigo del expresidente Alan García, Mauricio Mulder, explicó por qué su partido no permite que le d… https://t.co/fqRgIlhAsD",140,2019-04-18 04:45:05,SocialFlow,55,32
1118735932012806144,El suicidio cometido por el expresidente de Perú Alan García es visto por su abogado Erasmo Reyna como un acto de h… https://t.co/YrX6zxm7bE,140,2019-04-18 04:40:05,SocialFlow,366,145
1118735415295578112,"""Creo en la vida después de la muerte"", dijo el expresidente de Perú Alan García a RPP Noticias un día antes de qui… https://t.co/hK73peTiGZ",140,2019-04-18 04:38:02,SocialFlow,85,47
1118734675529347072,"El congresista Mauricio Mulder, dirigente principal del Partido Aprista Peruano, dijo que ""la fiscalía buscaba un t… https://t.co/Z0mJg47GV2",140,2019-04-18 04:35:06,SocialFlow,50,34
1118733419616382976,¿En qué falló el Manchester City?: https://t.co/m7ELLOyLSQ,58,2019-04-18 04:30:06,SocialFlow,34,10
1118732156115849216,"""Era obligación de la policía y del ministerio público encargarse de la seguridad y protección del expresidente"", d… https://t.co/4bjYrmEFSP",140,2019-04-18 04:25:05,SocialFlow,69,43
1118730905965801472,"Mira las imágenes a través de los años del expresidente de Perú Alan García, quien falleció este miércoles después… https://t.co/C8WqDbuXxN",139,2019-04-18 04:20:07,SocialFlow,60,28
1118729637234921473,"Erasmo Reyna, abogado de Alan García, calificó el allanamiento de la vivienda del expresidente de Perú como un even… https://t.co/qOpr0MuXgl",140,2019-04-18 04:15:05,SocialFlow,95,46
1118728383049994240,"Maluma y Madonna lanzaron su nueva canción ""Medellín"". 
https://t.co/Eg7OwOoufw",79,2019-04-18 04:10:06,SocialFlow,155,38
