id,text,len,date,source,likes,rt
1118984309371736064,Rusia anuncia encuentro entre Kim Jong Un y Putin https://t.co/aGJrMR4Cik,73,2019-04-18 21:07:03,SocialFlow,35,19
1118982558832840705,Las tradiciones más coloridas de Semana Santa en América Latina https://t.co/cIZ9iK7Ozq,87,2019-04-18 21:00:06,SocialFlow,17,11
1118982549164953613,Nace gran número de loros Kakapo en vía de extinción en Nueva Zelandia https://t.co/LGHyEsm0FL,94,2019-04-18 21:00:04,SocialFlow,77,16
1118981282384482315,"Científicos detectan la primera molécula del Big Bang en el espacio
 https://t.co/ZuRUsnTHWI",92,2019-04-18 20:55:02,SocialFlow,98,50
1118981047163736065,"""A él todo lo que lo quise y respeté, se lo dije en vida"", dijo Carla García. Este fue su mensaje:  https://t.co/TcmtklUzwS",123,2019-04-18 20:54:05,SocialFlow,33,11
1118978043261988866,"Trump tras designación de Mueller: ""Estoy j****o"" https://t.co/uoJJrMaJrk",73,2019-04-18 20:42:09,SocialFlow,23,3
1118975498049159170,5 películas que te harán recordar la Semana Santa de antaño. ¿Cuál sumarías a la lista?: https://t.co/MgMtfVaZ2S,112,2019-04-18 20:32:02,SocialFlow,74,28
1118971970639532035,"En la misa de Jueves Santo, en el Vaticano, el papa Francisco pidió a los sacerdotes que mantengan el contacto y la… https://t.co/4vLqSn8zrF",140,2019-04-18 20:18:01,SocialFlow,114,25
1118970586649321473,Un raro descubrimiento abre la posibilidad de clonar un caballo que vivió hace 42.000 años https://t.co/uFlOuvrvVW,114,2019-04-18 20:12:31,SocialFlow,243,107
1118969471937462273,"¿Qué significan los ramos, los huevos de pascua y por qué se hace ayuno en Semana Santa? Algunas claves de la seman… https://t.co/GWWgHBtx62",140,2019-04-18 20:08:06,SocialFlow,54,26
1118968954733694981,Escuela de ballet en Nairobi enriquece el alma de jóvenes bailarines https://t.co/ZpCL3a6Dt5,92,2019-04-18 20:06:02,SocialFlow,44,9
1118965438061346817,Buzo que ayudó a salvar a los niños de la cueva de Tailandia quedó atrapado en una cueva y tuvo que ser rescatado https://t.co/bzxnjqyrn9,137,2019-04-18 19:52:04,SocialFlow,124,56
1118965174654906369,Esto es lo que debes saber sobre el informe de Mueller https://t.co/9pRRD3ulGj,78,2019-04-18 19:51:01,SocialFlow,14,9
1118964685326438400,Cuatro enseñanzas de Jesús que nadie entiende https://t.co/bZDWz2GNoJ,69,2019-04-18 19:49:04,SocialFlow,109,37
1118962415343996932,4 conclusiones clave del reporte editado de Robert Mueller https://t.co/vWnraVHETA,82,2019-04-18 19:40:03,SocialFlow,16,7
1118962165942300674,"Rocío Vélez, estratega del partido republicano, dijo que el presentación del informe editado del fiscal especial Ro… https://t.co/IxwAyn5TUM",140,2019-04-18 19:39:04,SocialFlow,16,3
1118961784533213190,"Mueller: Trump quiso obstruir, pero su equipo lo desafió https://t.co/5irajSjEcO https://t.co/HUPJ7grBF7",104,2019-04-18 19:37:33,SocialFlow,20,3
1118960916530454528,Las reacciones en Latinoamérica tras la muerte del expresidente de Perú Alan García https://t.co/uZPmXIzBQO,107,2019-04-18 19:34:06,SocialFlow,22,11
1118958570249302017,Avance de la ciencia podría curar grave enfermedad conocida como el síndrome del niño burbuja https://t.co/vTKrUApnpv,117,2019-04-18 19:24:47,SocialFlow,68,18
1118956637014900736,¿Sabes el origen y qué se celebra en Semana Santa? https://t.co/86nKEFVfvf,74,2019-04-18 19:17:06,SocialFlow,35,18
1118954864904757248,Muere ballena en una playa de Chile tras pasar más de 6 horas varada https://t.co/yGorkGx2R4,92,2019-04-18 19:10:03,SocialFlow,47,35
1118954110273896448,4 conclusiones clave del reporte editado de Robert Mueller https://t.co/A8kSTkohrw,82,2019-04-18 19:07:03,SocialFlow,15,2
1118953870842040321,A un año de la crisis en Nicaragua: ¿hay avances en las negociaciones? https://t.co/c5lwdxxmaU,94,2019-04-18 19:06:06,SocialFlow,21,10
1118952402185531394,Las primeras imágenes aéreas de Notre Dame tras el incendio https://t.co/ZTEoYFfBfy,83,2019-04-18 19:00:16,SocialFlow,26,9
1118952362016636928,¿Sabes el origen y qué se celebra en Semana Santa? https://t.co/aJfXmenbqT,74,2019-04-18 19:00:06,SocialFlow,18,9
1118950893767069696,"""A él todo lo que lo quise y respeté, se lo dije en vida"", dijo Carla García. Este fue su mensaje:  https://t.co/ZQ7XAZgrLt",123,2019-04-18 18:54:16,SocialFlow,47,11
1118949839960780801,"20 años de Columbine, la matanza que marcó un hito en ataques a escuelas de EE.UU. https://t.co/HknfDAuWvC",106,2019-04-18 18:50:05,SocialFlow,38,15
1118947581185462272,BTS rompe récords y se apodera de YouTube https://t.co/78Hijj8rZ1,65,2019-04-18 18:41:07,SocialFlow,52,11
1118946573134835714,Sigue a ➡️ @serhumanocnn https://t.co/zd6bD44iqa,48,2019-04-18 18:37:06,TweetDeck,9,4
1118945331864068096,5 películas que te harán recordar la Semana Santa de antaño. ¿Cuál sumarías a la lista?: https://t.co/NZuYMHEl9j,112,2019-04-18 18:32:10,SocialFlow,85,41
1118941792076955648,¿Existió Jesús?: separando al hombre del mito https://t.co/PQJXg9Xlo1,69,2019-04-18 18:18:06,SocialFlow,148,43
1118940287894732801,Dra. Azaret: Es necesario abrir un diálogo sobre lo que es querer quitarse la vida https://t.co/tJwii4OhQb,106,2019-04-18 18:12:08,SocialFlow,32,14
1118937299948118017,Así reaccionaron los peruanos tras el suicidio de Alan García https://t.co/KtEK3SpXun,85,2019-04-18 18:00:15,SocialFlow,11,9
1118935987307057157,"Científicos detectan la primera molécula del Big Bang en el espacio
 https://t.co/zvJLeti5vB",92,2019-04-18 17:55:02,SocialFlow,172,74
1118934220397850624,¿Cuántos indocumentados están cumpliendo condenas en cárceles estadounidenses? https://t.co/6TbZMwovLp,102,2019-04-18 17:48:01,SocialFlow,12,16
1118934211568652288,¿Qué hay de verdad sobre la cruz de Jesús? https://t.co/jjmJUkPjSY,66,2019-04-18 17:47:59,SocialFlow,53,20
1118932219807051777,Francia lanzará un concurso para reconstruir la aguja de Notre Dame https://t.co/Zb2ddZxYP4,91,2019-04-18 17:40:04,SocialFlow,113,38
1118929728428228613,Cientos de arrestos en protestas por cambio climático en Londres https://t.co/TmRVyDkTy2,88,2019-04-18 17:30:10,SocialFlow,44,22
1118928455188533248,Zacatecas ofrece un Festival Cultural para estas vacaciones de Semana Santa y de Pascua https://t.co/7FVa4dtqX0,111,2019-04-18 17:25:07,SocialFlow,17,13
1118928192243404801,"Así se celebra la Semana Santa en Taxco, México, una población que conjuga tradición y belleza https://t.co/z3XUX8dUdv",118,2019-04-18 17:24:04,SocialFlow,62,14
1118927936957161473,Los tendidos de Cristo: conoce esta misteriosa tradición de Semana Santa en México https://t.co/IZInQjcK7m,106,2019-04-18 17:23:03,SocialFlow,22,15
1118927681528242178,"La devoción de San Cristóbal de las Casas, Chiapas, en Semana Santa https://t.co/rzLeFMuYZv",91,2019-04-18 17:22:02,SocialFlow,29,12
1118926686517714945,"Mueller: La obstrucción de la justicia por parte de Trump falló porque otros se negaron a ""cumplir órdenes"" https://t.co/t8IaHhSFFx",131,2019-04-18 17:18:05,SocialFlow,40,18
1118925940418129926,El grupo de K-pop BTS toma el control de Saturday Night Live https://t.co/2YUTY7qW3R,84,2019-04-18 17:15:07,SocialFlow,38,10
1118925675216424960,¿Sabes el origen y qué se celebra en Semana Santa? https://t.co/I0g531KJfx,74,2019-04-18 17:14:04,SocialFlow,43,22
1118924917821583361,Analista: El presidente tiene todo lo necesario para terminar el tema de la colusión https://t.co/Jlia6363Lk,108,2019-04-18 17:11:03,SocialFlow,22,11
1118923150295801857,ICE debe tener una orden emitida por un juez para hacer arrestos de inmigrantes dentro de las cortes del Estado de… https://t.co/escMS0f5oM,139,2019-04-18 17:04:02,SocialFlow,32,13
1118922177695354883,¿Quién era realmente Alan García? Hacemos un breve recorrido por su vida https://t.co/A9BOAAvvYm,96,2019-04-18 17:00:10,SocialFlow,29,7
1118922147584512000,Las tradiciones más coloridas de Semana Santa en América Latina https://t.co/55ouAUJM8t,87,2019-04-18 17:00:03,SocialFlow,22,6
1118920899502256129,Puebla espera 170.000 asistentes a la Procesión de Viernes Santo https://t.co/qMr5vewr6u,88,2019-04-18 16:55:05,SocialFlow,44,7
1118920144556896256,Buzo que ayudó a salvar a los niños de la cueva de Tailandia quedó atrapado en una cueva y tuvo que ser rescatado https://t.co/h9tn9xZz2C,137,2019-04-18 16:52:05,SocialFlow,150,51
1118918644539564035,"Cientos parten con la ""Caravana del Viacrucis"" sin completar trámites migratorios https://t.co/UuatP5bOZE",105,2019-04-18 16:46:08,SocialFlow,12,5
1118918643369295873,"Rocío Vélez, estratega del partido republicano, dijo que el presentación del informe editado del fiscal especial Ro… https://t.co/dgkLrHJ7OD",140,2019-04-18 16:46:07,SocialFlow,22,7
1118916368697561088,Puedes leer el informe completo de Mueller aquí: https://t.co/gt76DxA1uK,72,2019-04-18 16:37:05,SocialFlow,25,14
1118915944661884928,Sigue a ➡️ @serhumanocnn https://t.co/krIhtFY11C,48,2019-04-18 16:35:24,TweetDeck,20,5
1118914860413222912,"Un número creciente de compañías minoristas están cerrando sus tiendas para ser más selectivos, dónde abren o forta… https://t.co/r9syGT5hdJ",140,2019-04-18 16:31:05,SocialFlow,23,16
1118914597644308480,"""Este es el final de mi presidencia"", dijo Trump cuando Mueller fue nombrado para el cargo, según el informe https://t.co/5CF4udooGm",132,2019-04-18 16:30:03,SocialFlow,49,27
1118913167466344448,Lo que sabemos hasta el momento del informe de Mueller https://t.co/vko4SxaGkh,78,2019-04-18 16:24:22,SocialFlow,17,12
1118912851920457728,"Las 5 batallas que se esperan después que se publique el informe Mueller
 https://t.co/wHAjbEu9iF",97,2019-04-18 16:23:06,SocialFlow,20,17
1118912096127922181,Netflix registra récord de nuevas suscripciones https://t.co/tQRaJyeGgm,71,2019-04-18 16:20:06,SocialFlow,71,17
1118908326400659457,A un año de la crisis en Nicaragua: ¿hay avances en las negociaciones? https://t.co/75ngvbR9G3,94,2019-04-18 16:05:07,SocialFlow,32,13
1118906549223686144,El tratamiento hormonal para la menopausia no siempre es necesario y puede estar contraindicado. Este sábado este y… https://t.co/Y5BQ7Iek5Q,140,2019-04-18 15:58:04,SocialFlow,34,17
1118905044756238338,Estados Unidos anuncia un cambio a su política de asilo https://t.co/K46ZhcF8PQ,79,2019-04-18 15:52:05,SocialFlow,30,19
1118902274946994177,"Abogado de Alan García: ""Prefirió el honor ante la indignidad"" https://t.co/EOb23mIJP0",86,2019-04-18 15:41:05,SocialFlow,66,33
1118901269169680384,La familia de Alan García declina hacer un funeral de Estado para el expresidente de Perú https://t.co/pP2xgrVgfa,113,2019-04-18 15:37:05,SocialFlow,45,25
1118899997448245248,"Diego Boneta incursiona como narrador en la serie ""Dinastías"" de Discovery Channel y BBC Studios https://t.co/fteIFaSiUT",120,2019-04-18 15:32:02,SocialFlow,91,24
1118899755977932813,Barr: Rusia intentó interferir en las elecciones de EE.UU. https://t.co/yvM4fcPy4i,82,2019-04-18 15:31:04,SocialFlow,35,20
1118897739092430848,"Las 5 batallas que se esperan después que se publique el informe Mueller
 https://t.co/cotVH1oork",97,2019-04-18 15:23:03,SocialFlow,32,17
1118897480878514183,Buzo que ayudó a salvar a los niños de la cueva de Tailandia quedó atrapado en una cueva y tuvo que ser rescatado https://t.co/ZRPboXZTfz,137,2019-04-18 15:22:02,SocialFlow,63,19
1118897243950583809,A un año de la crisis en Nicaragua: ¿hay avances en las negociaciones? https://t.co/N3iVGTBaPO,94,2019-04-18 15:21:05,SocialFlow,29,13
1118896521141993472,"ÚLTIMA HORA
Las comisiones de Senado y Cámara ya tienen el informe de Mueller https://t.co/EVitQvEXoP https://t.co/OdiTMFULIw",125,2019-04-18 15:18:13,SocialFlow,22,25
1118895469554556930,¿Sabes el origen y qué se celebra en Semana Santa? https://t.co/i0DVXiYEX0,74,2019-04-18 15:14:02,SocialFlow,32,18
1118894976648339460,¿Cuántos indocumentados están cumpliendo condenas en cárceles estadounidenses? https://t.co/qcdUBFZmjU,102,2019-04-18 15:12:05,SocialFlow,28,12
1118894465383632896,ICE debe tener una orden emitida por un juez para hacer arrestos de inmigrantes dentro de las cortes del Estado de… https://t.co/DKUENSdemq,139,2019-04-18 15:10:03,SocialFlow,25,15
1118891996461051905,Subastan un Tyrannosaurus rex en eBay https://t.co/ZgXPwfHSFW,61,2019-04-18 15:00:14,SocialFlow,17,8
1118891968166342657,Los destinos que más buscan los latinoamericanos para sus vacaciones de Semana Santa https://t.co/sLieqCADtY,108,2019-04-18 15:00:07,SocialFlow,46,16
1118890705617936384,"Científicos detectan la primera molécula del Big Bang en el espacio
 https://t.co/PPvStaoAQi",92,2019-04-18 14:55:06,SocialFlow,352,153
1118888182018445312,Arrestan a un hombre que entró con latas de gasolina y mecheros en la catedral de San Patricio en Nueva York https://t.co/3UowVS1EVx,132,2019-04-18 14:45:05,SocialFlow,39,37
1118887184793329669,"""Medellín"", la nueva canción de Madonna y Maluma. ¿Cómo te pareció?
https://t.co/dRwBoS850t",91,2019-04-18 14:41:07,SocialFlow,165,31
1118885784768208897,"ÚLTIMA HORA 
Se vuelca un camión que transportaba decenas de inmigrantes en México https://t.co/eC03rhGynu",106,2019-04-18 14:35:33,SocialFlow,172,196
1118885723938131968,"Los abogados del presidente no solicitaron hacer ni se les permitió hacer ninguna edición, dice Barr https://t.co/onnGzFWaaS",124,2019-04-18 14:35:19,SocialFlow,17,2
1118881141287739392,Trump reacciona a la rueda de prensa de Barr sobre el informe de Mueller con un tuit al estilo Game of Thrones. Mir… https://t.co/nlZ5STcc6m,140,2019-04-18 14:17:06,SocialFlow,17,7
1118879376215629830,"Guía para el informe Mueller: ¿qué es, qué contiene y cuándo lo veremos?
 https://t.co/z77iaTwpbn",97,2019-04-18 14:10:05,SocialFlow,22,10
1118876867505922049,"El informe Mueller se divulga hoy: ¿qué contiene y por qué es tan importante? Todo lo que debes saber aquí: 
https://t.co/fhT9avMtFr",132,2019-04-18 14:00:07,SocialFlow,10,8
1118876866163740674,"El Departamento de Justicia publicará dos versiones editadas del informe Mueller
 https://t.co/hXlCxa58wW",105,2019-04-18 14:00:07,SocialFlow,4,2
1118876852347711489,"Cientos parten con la ""Caravana del Viacrucis"" sin completar trámites migratorios https://t.co/tCdVf7AwVM",105,2019-04-18 14:00:03,SocialFlow,11,11
1118875320445222912,Barr: El gobierno ruso trató de interferir en elecciones. Sigue aquí minuto a minuto lo que debes saber del informe… https://t.co/CHYzIbO5Cz,140,2019-04-18 13:53:58,SocialFlow,26,20
1118874836724584448,"Una vez más, el Manchester City defrauda en la Liga de Campeones https://t.co/CyNvu3aisx",88,2019-04-18 13:52:03,SocialFlow,26,10
1118873895967363072,Llegó el día que estaba esperando Washington: este jueves se conocerá una versión editada del informe de  Robert Mu… https://t.co/Y1YeoTIMNd,140,2019-04-18 13:48:19,SocialFlow,16,3
1118872478946942977,"Sigue aquí EN VIVO la rueda de prensa de Barr sobre el informe de Mueller: 
https://t.co/DGAGCceXtk",99,2019-04-18 13:42:41,SocialFlow,18,7
1118871816590721025,"Mauricio Mulder, amigo de García y congresista del APRA, aseveró que el expresidente tuvo ""un acto de dignidad"" https://t.co/6coUOBwJR7",135,2019-04-18 13:40:03,SocialFlow,79,21
1118870434483712002,Sigue aquí EN VIVO la conferencia de prensa del secretario de Justicia sobre el informe Mueller: https://t.co/3wC3LadzMD,120,2019-04-18 13:34:33,SocialFlow,15,10
1118869297974194176,"El informe Mueller se divulga hoy: ¿qué contiene y por qué es tan importante? Todo lo que debes saber aquí: 
https://t.co/MvhH6evpz3",132,2019-04-18 13:30:02,SocialFlow,16,9
1118869296598401024,"El gobierno de Estados Unidos impuso sanciones contra el Banco Central de Venezuela, algo que despertó una reacción… https://t.co/9t7iiILErE",140,2019-04-18 13:30:02,SocialFlow,189,93
1118867390215991298,"Presentan versión editada del informe de Mueller: 
- 9.30 a.m. ET: Wiliam Barr da una conferencia de prensa y respo… https://t.co/2vvxSleEQL",140,2019-04-18 13:22:28,SocialFlow,19,8
1118866330378211329,"Washington espera el reporte de Mueller, pero puede que no resuelva nada https://t.co/O1Pr8jb99W",96,2019-04-18 13:18:15,SocialFlow,24,13
1118865278174224386,El secretario de Justicia William Barr dará una conferencia de prensa antes de que se conozca el informe de Mueller… https://t.co/fkEMD89zZF,140,2019-04-18 13:14:04,SocialFlow,16,6
1118864272958922752,La familia de Alan García declina hacer un funeral de Estado para el expresidente de Perú https://t.co/P8QgLuoMfI,113,2019-04-18 13:10:04,SocialFlow,131,50
1118861766728065025,"El informe Mueller se divulga hoy: ¿qué contiene y por qué es tan importante? Todo lo que debes saber aquí: 
https://t.co/1jYtzecnPZ",132,2019-04-18 13:00:07,SocialFlow,20,12
1118859482568720384,"El Departamento de Justicia publicará dos versiones editadas del informe Mueller
 https://t.co/jFuD6C0ypE",105,2019-04-18 12:51:02,SocialFlow,20,8
1118856747379298304,"Guía para el informe Mueller: ¿qué es, qué contiene y cuándo lo veremos?
 https://t.co/MOJY3ue8TP",97,2019-04-18 12:40:10,SocialFlow,17,12
1118856745605050369,"El líder de Corea del Norte Kim Jong Un se reunirá con el presidente de Rusia Vladimir Putin en Rusia este mes 
https://t.co/Qwpcm5pTnO",135,2019-04-18 12:40:10,SocialFlow,47,23
1118855251291979776,El secretario de Justicia William Barr dará una conferencia de prensa antes de que se conozca el informe de Mueller… https://t.co/wPtLIGaNgY,140,2019-04-18 12:34:13,SocialFlow,17,8
1118851951293284354,Hallan muerta a mujer que desató el pánico a días del aniversario 20 de la masacre de Columbine https://t.co/LIQTXC5xYk,119,2019-04-18 12:21:07,SocialFlow,29,16
1118851702227185664,La corrupción en Venezuela ha creado una superautopista de cocaína a EE.UU. https://t.co/k8FOzOMREL,99,2019-04-18 12:20:07,SocialFlow,596,582
1118849172776673280,Rescatan a pareja atrapada entre cocodrilos: desde el aire vieron su pedido de ayuda https://t.co/vmh6NJBZg1,108,2019-04-18 12:10:04,SocialFlow,257,84
1118846678377873408,"La muerte de Alan García recuerda el destino final de algunos líderes políticos mundiales que, presionados por cues… https://t.co/gC5ew9o0eI",140,2019-04-18 12:00:09,SocialFlow,111,67
1118846664935137284,¿Por qué Alan García no recibirá honores de estado en su funeral? https://t.co/joWwyC8kRF,89,2019-04-18 12:00:06,SocialFlow,24,16
1118845400889331714,Pyongyang quiere a Pompeo fuera de las conversaciones con EE.UU.: https://t.co/2vtRgUHOhg,89,2019-04-18 11:55:05,SocialFlow,49,27
1118845341481226241,"ÚLTIMA HORA
Confirman reunión entre Putin y Kim Jong Un 
https://t.co/iKrMDspqST",80,2019-04-18 11:54:51,SocialFlow,188,160
1118844142573031424,"La mayoría de las víctimas eran alemanas, dijo una funcionaria: https://t.co/v6nQVP6OH0",87,2019-04-18 11:50:05,SocialFlow,31,27
1118842886408347649,"Bradley Welsh, actor de 'Trainspotting', muere asesinado a tiros en Escocia: https://t.co/scevkYX9zE",100,2019-04-18 11:45:05,SocialFlow,21,19
1118841631988432896,"Una hamburguesa de cannabis, ¿la probarías?: https://t.co/RXTbp4XwOF",68,2019-04-18 11:40:06,SocialFlow,77,33
1118840362611744768,"Una versión editada del informe será divulgada al público y otra, menos editada, será enviada a un número limitado… https://t.co/k7Y4S54qYi",139,2019-04-18 11:35:04,SocialFlow,17,10
1118839101573275648,La peligrosa obsesión por Columbine a 20 años de la masacre: https://t.co/VtAdjavUKK,84,2019-04-18 11:30:03,SocialFlow,15,5
1118837859430076416,"Científicos detectan la primera molécula del Big Bang en el espacio
https://t.co/TcGAk38NrH",91,2019-04-18 11:25:07,SocialFlow,525,209
1118836592137965569,Trump da marcha atrás a la política de Obama hacia Cuba: ¿cuáles serán las consecuencias?: https://t.co/yd6bnx2m4L,114,2019-04-18 11:20:05,SocialFlow,57,26
1118835341631291392,"Corea del Norte prueba arma 'táctica': ¿mensaje para Estados Unidos?
https://t.co/iK6CSKvAA2",92,2019-04-18 11:15:07,SocialFlow,29,17
1118834074762776583,En Nicaragua se cumple un año de las manifestaciones contra el Gobierno de Daniel Ortega que han sacudido el país y… https://t.co/nNZi9btdy4,140,2019-04-18 11:10:05,SocialFlow,159,125
1118832812306632705,Estos son los latinos en la lista de los más influyentes del mundo: https://t.co/phap6mRKPb,91,2019-04-18 11:05:04,SocialFlow,211,87
1118831577654530048,"Guía para el informe Mueller: ¿qué es, qué contiene y cuándo lo veremos? https://t.co/VTbhVjMPs4 https://t.co/NkwDL6XP2W",120,2019-04-18 11:00:09,SocialFlow,16,11
1118829034597691392,¿Euién era Alan García? ¿Qué impacto tuvo su labor como presidente en Perú? ¿En qué escándalos estaba implicado? Ha… https://t.co/4GlUMWXbUO,140,2019-04-18 10:50:03,SocialFlow,39,32
1118827650125115394,"Corea del Norte: si Estados Unidos quiere hablar, que ponga a cargo a alguien 'más maduro' que Pompeo:… https://t.co/UVkNfCwHx3",127,2019-04-18 10:44:33,SocialFlow,57,33
1118826524789047297,La muerte del expresidente de Perú Alan García generó conmoción en el mundo. Y la forma en la que falleció levanta… https://t.co/R2frlKIWsP,139,2019-04-18 10:40:04,SocialFlow,81,41
1118824006629588992,"El 20 de abril de 1999, dos estudiantes de la escuela secundaria Columbine, en Colorado, mataron a 13 personas en u… https://t.co/rPqviWxXss",140,2019-04-18 10:30:04,SocialFlow,39,30
1118822741472415745,Al menos 28 personas murieron y otras 28 resultaron heridas luego de que un autobús turístico se estrellara en la i… https://t.co/DNjo0vDhBt,140,2019-04-18 10:25:02,SocialFlow,24,31
1118821677826289664,"RT @cafecnn: ¿Cómo percibe que se están desarrollando las investigaciones por corrupcion de Odebrecht en su país?
Nuestro tema de conversac…",140,2019-04-18 10:20:49,TweetDeck,0,36
1118821496783286272,Fumar durante el embarazo aumenta el riesgo por muerte súbita del bebé: https://t.co/VQwpW73d0L,95,2019-04-18 10:20:06,SocialFlow,31,30
1118820244129308672,"- El suicidio de Alan García
- El informe editado de Mueller 
- Venezuela y la superautopista de cocaína hacia EE.U… https://t.co/9U3aIyX84E",140,2019-04-18 10:15:07,SocialFlow,109,69
1118818983799599111,"La corona de espinas, uno de los símbolos religiosos de la cristiandad, fue rescatado junto con otras reliquias tra… https://t.co/l8tvTvorQ4",140,2019-04-18 10:10:07,SocialFlow,65,22
1118818726244233216,Actor de 'Trainspotting' es asesinado en Escocia: https://t.co/sthdGom6yB,73,2019-04-18 10:09:05,SocialFlow,19,21
1118816480227885058,Joven sobrevive a un terrible accidente laboral: una barra de hierro atravesó su cráneo: https://t.co/UtGHJRNqz8,112,2019-04-18 10:00:10,SocialFlow,16,15
1118813936445526016,Estados Unidos y otros funcionarios regionales dicen que es la propia élite militar y política de Venezuela la que… https://t.co/O9Q9LtN4Kx,139,2019-04-18 09:50:03,SocialFlow,204,238
1118811429094809600,"El presidente de México, Andrés Manuel López Obrador, firmó el martes un memorándum para dejar sin efecto las medid… https://t.co/WpN1rV524C",140,2019-04-18 09:40:05,SocialFlow,18,19
1118808923090374656,"Alcalde de Yuma, Arizona, declara emergencia por la ""amenaza inminente"" de los inmigrantes: https://t.co/Vsgf8dHUzE",115,2019-04-18 09:30:08,SocialFlow,14,10
1118807656347648005,"Carl's Jr. anunció que venderá la hamburguesa Rocky Mountain High: CheeseBurger Delight, que contiene una salsa con… https://t.co/TZ4vXTcNqL",140,2019-04-18 09:25:06,SocialFlow,22,15
1118807150745280513,"Las mejores colaboraciones de Maluma. 
https://t.co/FdLQYSHdRH ¿Cuál es tu favorita?",84,2019-04-18 09:23:05,SocialFlow,13,4
1118807144751562753,"Maluma + Madonna  
https://t.co/T3m5nEKYws",42,2019-04-18 09:23:04,SocialFlow,16,7
1118806400384339970,Meteoro interestelar pudo golpear la Tierra (y las implicaciones sobre la vida extraterrestre son fascinantes): https://t.co/WSadnnsi5H,135,2019-04-18 09:20:06,SocialFlow,44,17
1118803860863299585,"Para acceder a la pornografía en línea, los adultos tendrían que presentar documentos de identificación como tarjet… https://t.co/9gOmp6sa4n",140,2019-04-18 09:10:01,SocialFlow,38,6
1118802608355971074,El Departamento de Justicia publicará dos versiones editadas del informe Mueller: https://t.co/t6VypXisps,105,2019-04-18 09:05:02,SocialFlow,7,3
1118801369983606784,Investigadores restauraron funciones de cerebros de cerdos muertos. ¿Se podría hacer lo mismo con el cerebro humano… https://t.co/o7GQ96rLeK,140,2019-04-18 09:00:07,SocialFlow,26,13
1118798835835338757,Los problemas del 737 Max no son la única razón por la que las tarifas serán más altas: https://t.co/Hp5uL3A3yS,111,2019-04-18 08:50:03,SocialFlow,10,8
1118797858965196801,20 años de Columbine: la policía dice que una joven de 18 años que hizo amenazas creíbles estaba obsesionada con la… https://t.co/cVwwkJC6CM,140,2019-04-18 08:46:10,SocialFlow,19,13
1118796324802056193,"La muerte de Alan García recuerda el destino final de algunos líderes políticos mundiales que, presionados por cues… https://t.co/NkqIt6BSXH",140,2019-04-18 08:40:04,SocialFlow,35,29
1118795072047386626,"Maluma está causando furor por su nueva canción ""Medellín"" interpretada en dueto con Madonna. Conoce más sobre los… https://t.co/FgQb8bXVtQ",139,2019-04-18 08:35:06,SocialFlow,26,14
1118793807183609856,Treinta empleados que trabajaban en la catedral de Notre Dame antes de que estallara el incendio ya fueron interrog… https://t.co/lS0fwe9dGw,140,2019-04-18 08:30:04,SocialFlow,19,13
1118792541179187201,El expresidente de Perú Alan García ya había solicitado refugio político en 2018 a Uruguay y en otros países con el… https://t.co/Z2pjN1vD9U,140,2019-04-18 08:25:02,SocialFlow,21,20
1118791289355550720,"Guía para el informe Mueller: ¿qué es, qué contiene y cuándo lo veremos?: https://t.co/mp9bXXX1J1",97,2019-04-18 08:20:04,SocialFlow,7,8
